No.,Sentence,StemWords,MatchWords,Use
72,"In its 2015 Data Breach Investigations Report,  Verizon observes that many breaches are enabled by not addressing these known vulnerabilities,  noting that 99.9% of exploited vulnerabilities were compromised more than a year after public  disclosure of the issue.","['data', 'breach', 'investig', 'report', 'verizon', 'observ', 'mani', 'breach', 'enabl', 'address', 'known', 'vulner', 'note', 'exploit', 'vulner', 'compromis', 'year', 'public', 'disclosur', 'issu']",set(),N
73,"Moreover, Cisco’s 2015 Annual Security Report points out that 40% of CISOs  interviewed in a survey indicated they did not have system patching programs in place.","['moreov', 'cisco', 'annual', 'secur', 'report', 'point', 'ciso', 'interview', 'survey', 'indic', 'system', 'patch', 'program', 'place']",{'secur'},Y
74,These  unpatched vulnerabilities amount to a “low-hanging fruit” that cyber criminals can easily take  advantage of.,"['unpatch', 'vulner', 'amount', 'fruit', 'cyber', 'crimin', 'easili', 'take', 'advantag']",{'cyber'},Y
75,"To protect one’s organization from these opportunistic attacks, a system of monitoring for and  applying system patches and updates should be implemented.","['protect', 'one', 'organ', 'opportunist', 'attack', 'system', 'monitor', 'appli', 'system', 'patch', 'updat', 'implement']","{'organ', 'implement'}",Y
76,"WaterISAC regularly posts  information on vulnerabilities and patches, which it receives from its partners at the U.S.  Department of Homeland Security’s ICS-CERT and United States Computer Emergency Readiness  Team (US-CERT), other ISACs, and cybersecurity firms, among others.","['waterisac', 'regularli', 'post', 'inform', 'vulner', 'patch', 'receiv', 'partner', 'depart', 'homeland', 'secur', 'unit', 'state', 'comput', 'emerg', 'readi', 'team', 'isac', 'cybersecur', 'firm', 'among', 'other']","{'secur', 'inform', 'waterisac', 'cybersecur'}",Y
77,"Where possible, organizations  should also consider setting systems and software to auto-update to avoid missing critical updates.","['possibl', 'organ', 'also', 'consid', 'set', 'system', 'softwar', 'avoid', 'miss', 'critic', 'updat']",{'organ'},Y
78,These updates are designed to fix known vulnerabilities and are encouraged for any Internet- connected device.,"['updat', 'design', 'fix', 'known', 'vulner', 'encourag', 'connect', 'devic']",{'devic'},Y
79,?,[],set(),N
80,Recommended Practice for Patch Management of Control Systems (ICS-CERT)   WaterISAC     June 2015   10 Basic Cybersecurity Measures   4   ?,"['recommend', 'practic', 'patch', 'manag', 'control', 'system', 'waterisac', 'june', 'basic', 'cybersecur', 'measur']","{'control', 'waterisac', 'practic', 'manag', 'measur', 'cybersecur'}",Y
81,Software Update Management Guidelines (Microsoft)  ?,"['softwar', 'updat', 'manag', 'guidelin', 'microsoft']",{'manag'},Y
82,"Index of Advisories by Vendor (ICS-CERT)     7)  Develop and Enforce Policies on Mobile Devices   The proliferation of laptops, tablets, smartphones, and other mobile devices in the workplace  presents significant security challenges.","['index', 'advisori', 'vendor', 'develop', 'enforc', 'polici', 'mobil', 'devic', 'prolifer', 'laptop', 'tablet', 'smartphon', 'mobil', 'devic', 'workplac', 'present', 'signific', 'secur', 'challeng']","{'secur', 'develop', 'devic'}",Y
83,"The mobile nature of these devices means they are  potentially exposed to external, compromised applications and networks and malicious actors.","['mobil', 'natur', 'devic', 'mean', 'potenti', 'expos', 'extern', 'compromis', 'applic', 'network', 'malici', 'actor']","{'network', 'devic'}",Y
84,"Further contributing to this challenge is the increasing trend of organizations allowing employees  to use their personal electronic devices for work purposes, known as the “Bring Your Own Device  (BYOD)” phenomenon.","['contribut', 'challeng', 'increas', 'trend', 'organ', 'allow', 'employe', 'use', 'person', 'electron', 'devic', 'work', 'purpos', 'known', 'bring', 'devic', 'byod', 'phenomenon']","{'organ', 'work', 'devic'}",Y
85,"Therefore, it’s important to develop policies on the reasonable limits of mobile devices in your  office and on your networks.","['therefor', 'import', 'develop', 'polici', 'reason', 'limit', 'mobil', 'devic', 'offic', 'network']","{'network', 'develop', 'devic'}",Y
86,"These measures should be strictly enforced for all employees, as well  as for contractors.","['measur', 'strictli', 'enforc', 'employe', 'well', 'contractor']",{'measur'},Y
87,Devices should also be password protected to ensure only authorized users can  log-in.,"['devic', 'also', 'password', 'protect', 'ensur', 'author', 'user']",{'devic'},Y
88,"Otherwise, an unauthorized user can gain access to restricted networks and files using an  authorized user’s device.","['otherwis', 'unauthor', 'user', 'gain', 'access', 'restrict', 'network', 'file', 'use', 'author', 'user', 'devic']","{'network', 'devic', 'access'}",Y
89,"Similarly, employees should avoid or be cautious about using devices that  do not belong to them as they cannot be sure these are properly protected or comply with  established policy.","['similarli', 'employe', 'avoid', 'cautiou', 'use', 'devic', 'belong', 'sure', 'properli', 'protect', 'compli', 'establish', 'polici']",{'devic'},Y
90,"Such devices may actually be infected, and using them could put the information  and networks you access at risk.","['devic', 'may', 'actual', 'infect', 'use', 'could', 'put', 'inform', 'network', 'access', 'risk']","{'access', 'network', 'inform', 'devic'}",Y
91,?,[],set(),N
92,Cybersecurity for Electronic Devices (US-CERT)  ?,"['cybersecur', 'electron', 'devic']","{'devic', 'cybersecur'}",Y
93,Guidelines on Cell Phone and PDA Security (NIST)  ?,"['guidelin', 'cell', 'phone', 'pda', 'secur', 'nist']",{'secur'},Y
94,"Bring Your Own Device (BYOD) Design Considerations Guide (Microsoft)      8)  Implement an Employee Cybersecurity Training Program   Cybersecurity for critical infrastructure sectors that operate industrial control systems, such as the  water and wastewater sector, is extremely important given that these systems are increasingly  being targeted.","['bring', 'devic', 'byod', 'design', 'consider', 'guid', 'microsoft', 'implement', 'employe', 'cybersecur', 'train', 'program', 'cybersecur', 'critic', 'infrastructur', 'sector', 'oper', 'industri', 'control', 'system', 'water', 'wastewat', 'sector', 'extrem', 'import', 'given', 'system', 'increasingli', 'target']","{'industri', 'control', 'implement', 'devic', 'cybersecur'}",Y
95,The 2015 Dell Security Annual Threat Report reports a doubling of the number of  attacks against SCADA systems in 2014 as compared to 2013.,"['dell', 'secur', 'annual', 'threat', 'report', 'report', 'doubl', 'number', 'attack', 'scada', 'system', 'compar']",{'secur'},Y
96,"Like any security enterprise,  cybersecurity requires teamwork with all members of an organization playing a part in identifying  potential threats and vulnerabilities and bringing them to the attention of others.","['like', 'secur', 'enterpris', 'cybersecur', 'requir', 'teamwork', 'member', 'organ', 'play', 'part', 'identifi', 'potenti', 'threat', 'vulner', 'bring', 'attent', 'other']","{'secur', 'organ', 'cybersecur', 'requir'}",Y
97,"When employees  aren’t involved in cybersecurity, not only can vulnerabilities and threats go unnoticed but the  employees themselves can become conduits through which attacks are executed.","['employe', 'involv', 'cybersecur', 'vulner', 'threat', 'go', 'unnot', 'employe', 'becom', 'conduit', 'attack', 'execut']",{'cybersecur'},Y
98,"Therefore,  employees should receive initial and periodic cybersecurity training, helping to maintain the security  of the organization as a whole.","['therefor', 'employe', 'receiv', 'initi', 'period', 'cybersecur', 'train', 'help', 'maintain', 'secur', 'organ', 'whole']","{'secur', 'organ', 'cybersecur'}",Y
99,"While cybersecurity is an expansive field, there are certain topics that should be emphasized for  general awareness.","['cybersecur', 'expans', 'field', 'certain', 'topic', 'emphas', 'gener', 'awar']",{'cybersecur'},Y
100,"One such topic is social engineering, which continues to be a popular means for  cyber criminals to prey upon unsuspecting employees.","['one', 'topic', 'social', 'engin', 'continu', 'popular', 'mean', 'cyber', 'crimin', 'prey', 'upon', 'unsuspect', 'employe']",{'cyber'},Y
101,"These methods involve emails (“phishing”),  phone calls, or other types of personal interactions in which malicious actors attempt to entice  employees into providing  sensitive personal or corporate information, such as account passwords  or details about information technology infrastructure.","['method', 'involv', 'email', 'phish', 'phone', 'call', 'type', 'person', 'interact', 'malici', 'actor', 'attempt', 'entic', 'employe', 'provid', 'sensit', 'person', 'corpor', 'inform', 'account', 'password', 'detail', 'inform', 'technolog', 'infrastructur']","{'inform', 'technolog'}",Y
102,"Alternatively, these actors might attempt to  make employees perform specific actions, such as pay for alleged services, download infected   WaterISAC     June 2015   10 Basic Cybersecurity Measures   5   attachments, or visit malicious websites.","['altern', 'actor', 'might', 'attempt', 'make', 'employe', 'perform', 'specif', 'action', 'pay', 'alleg', 'servic', 'download', 'infect', 'waterisac', 'june', 'basic', 'cybersecur', 'measur', 'attach', 'visit', 'malici', 'websit']","{'measur', 'waterisac', 'cybersecur'}",Y
103,"Unsolicited emails, phone calls, and other correspondence  from unknown senders should be viewed with particular caution.","['unsolicit', 'email', 'phone', 'call', 'correspond', 'unknown', 'sender', 'view', 'particular', 'caution']",set(),N
104,Training should also incorporate the importance of smart Internet browsing practices.,"['train', 'also', 'incorpor', 'import', 'smart', 'internet', 'brows', 'practic']","{'internet', 'practic'}",Y
105,Visiting  suspicious websites may expose users to infection by malware embedded on the site (a “drive-by- download” attack).,"['visit', 'suspici', 'websit', 'may', 'expos', 'user', 'infect', 'malwar', 'embed', 'site', 'download', 'attack']",set(),N
106,"Even legitimate websites, as well as the files on them, may be compromised.","['even', 'legitim', 'websit', 'well', 'file', 'may', 'compromis']",set(),N
107,"Cyber attackers employ a variation of this type of tactic, a “watering-hole” attack, to target the  employees of a company they know will visit the website.","['cyber', 'attack', 'employ', 'variat', 'type', 'tactic', 'attack', 'target', 'employe', 'compani', 'know', 'visit', 'websit']",{'cyber'},Y
108,"Therefore, caution should be exercised no  matter where a user navigates and the materials that are downloaded.","['therefor', 'caution', 'exercis', 'matter', 'user', 'navig', 'materi', 'download']",set(),N
109,?,[],set(),N
110,Avoiding Social Engineering and Phishing Attacks (US-CERT)   ?,"['avoid', 'social', 'engin', 'phish', 'attack']",set(),N
111,Recognizing and Avoiding Email Scams (US-CERT)  ?,"['recogn', 'avoid', 'email', 'scam']",set(),N
112,Securing Your Web Browser (US-CERT)  ?,"['secur', 'web', 'browser']",{'secur'},Y
113,"Incident Handling: Preparing for Incident Response (ICS-CERT)     9)  Involve Executives in Cybersecurity   Despite the continued proliferation of cyber threats and the far-reaching effects cyber attacks can  have, researchers have found that organizational leaders are often unaware of cybersecurity threats  and needs.","['incid', 'handl', 'prepar', 'incid', 'respons', 'involv', 'execut', 'cybersecur', 'despit', 'continu', 'prolifer', 'cyber', 'threat', 'effect', 'cyber', 'attack', 'research', 'found', 'organiz', 'leader', 'often', 'unawar', 'cybersecur', 'threat', 'need']","{'cyber', 'cybersecur'}",Y
114,"In a study of cyber incident response by the Ponemon Institute, researchers found that  only 20% of IT security professionals surveyed regularly communicated with management about  threats.","['studi', 'cyber', 'incid', 'respons', 'ponemon', 'institut', 'research', 'found', 'secur', 'profession', 'survey', 'regularli', 'commun', 'manag', 'threat']","{'secur', 'manag', 'cyber'}",Y
115,"Additionally, just 14% of these individuals reported that executive management participated  in the incident management process.","['addit', 'individu', 'report', 'execut', 'manag', 'particip', 'incid', 'manag', 'process']",{'manag'},Y
116,The study authors note that a deficit of involvement and  awareness by organization executives may make it difficult to secure funding for cybersecurity  measures and to get the support of leadership for company-wide efforts.,"['studi', 'author', 'note', 'deficit', 'involv', 'awar', 'organ', 'execut', 'may', 'make', 'difficult', 'secur', 'fund', 'cybersecur', 'measur', 'get', 'support', 'leadership', 'effort']","{'secur', 'organ', 'measur', 'cybersecur'}",Y
117,"While organizations are increasingly elevating cybersecurity to the executive level by adding the role  of Chief Information Security Officer (CISO), a recent report from ThreatTrack Security found that  this position has yet to achieve a sufficient level of respect and acceptance.","['organ', 'increasingli', 'elev', 'cybersecur', 'execut', 'level', 'ad', 'role', 'chief', 'inform', 'secur', 'offic', 'ciso', 'recent', 'report', 'threattrack', 'secur', 'found', 'posit', 'yet', 'achiev', 'suffici', 'level', 'respect', 'accept']","{'secur', 'organ', 'inform', 'cybersecur'}",Y
118,"Specifically, it found that  44% of executives believe CISOs should be accountable for any organizational data breaches, but  54% believe CISOs should not be responsible for cybersecurity purchasing decisions.","['specif', 'found', 'execut', 'believ', 'ciso', 'account', 'organiz', 'data', 'breach', 'believ', 'ciso', 'respons', 'cybersecur', 'purchas', 'decis']",{'cybersecur'},Y
119,The report  concludes that organizations must do a better job of understanding and utilizing this position.,"['report', 'conclud', 'organ', 'must', 'better', 'job', 'understand', 'util', 'posit']",{'organ'},Y
120,"Additionally, involving executives in cybersecurity now will help them to address cybersecurity in  their interactions with external stakeholders, such as if they are questioned following an incident.","['addit', 'involv', 'execut', 'cybersecur', 'help', 'address', 'cybersecur', 'interact', 'extern', 'stakehold', 'question', 'follow', 'incid']",{'cybersecur'},Y
121,"In  its report, M-Trends 2015: A View from the Front Lines, Mandiant discusses how the press,  partners, investors, and consumers now demand more details about cyber breaches, including the  type of malware used and how attackers gained access.","['report', 'view', 'front', 'line', 'mandiant', 'discuss', 'press', 'partner', 'investor', 'consum', 'demand', 'detail', 'cyber', 'breach', 'includ', 'type', 'malwar', 'use', 'attack', 'gain', 'access']","{'cyber', 'includ', 'access'}",Y
122,"Mandiant notes that victim organizations  realized “how crucial strong, consistent communication is in the wake of major breaches” given the  calls for timely information and the speculation that will arise when it is not provided.","['mandiant', 'note', 'victim', 'organ', 'realiz', 'crucial', 'strong', 'consist', 'commun', 'wake', 'major', 'breach', 'given', 'call', 'time', 'inform', 'specul', 'aris', 'provid']","{'organ', 'inform'}",Y
123,?,[],set(),N
124,"Cybersecurity Questions for CEOs (US-CERT)          WaterISAC     June 2015   10 Basic Cybersecurity Measures   6   10)  Implement Measures for Detecting Compromises and Develop a Cybersecurity Incident   Response Plan   Despite the many preventative measures organizations implement, many still experience  compromises.","['cybersecur', 'question', 'ceo', 'waterisac', 'june', 'basic', 'cybersecur', 'measur', 'implement', 'measur', 'detect', 'compromis', 'develop', 'cybersecur', 'incid', 'respons', 'plan', 'despit', 'mani', 'prevent', 'measur', 'organ', 'implement', 'mani', 'still', 'experi', 'compromis']","{'waterisac', 'implement', 'measur', 'develop', 'organ', 'cybersecur'}",Y
125,"Indeed, many cybersecurity experts have noted that experiencing a compromise is  not really a question of “if,” but more of a question of “when.” When a compromise occurs, the  organizations that fare the best will be those that quickly detect the issue and have a plan in place to  respond.","['inde', 'mani', 'cybersecur', 'expert', 'note', 'experienc', 'compromis', 'realli', 'question', 'question', 'compromis', 'occur', 'organ', 'fare', 'best', 'quickli', 'detect', 'issu', 'plan', 'place', 'respond']","{'organ', 'cybersecur'}",Y
126,"Implementing such measures as intrusion detection systems (IDSs) and intrusion prevention systems  (IPSs), anti-virus software, and logs (previously described in recommendation #4) can help to detect  compromises in their earliest stages.","['implement', 'measur', 'intrus', 'detect', 'system', 'idss', 'intrus', 'prevent', 'system', 'ipss', 'softwar', 'log', 'previous', 'describ', 'recommend', 'help', 'detect', 'compromis', 'earliest', 'stage']","{'implement', 'measur'}",Y
127,"Most IDSs and IPSs use signatures to detect port scans,  malware, and other abnormal network communications.","['idss', 'ipss', 'use', 'signatur', 'detect', 'port', 'scan', 'malwar', 'abnorm', 'network', 'commun']",{'network'},Y
128,"New viruses are discovered every day, and  anti-virus programs are oftentimes set to automatically update themselves to look for the latest  threat signatures.","['new', 'virus', 'discov', 'everi', 'day', 'program', 'oftentim', 'set', 'automat', 'updat', 'look', 'latest', 'threat', 'signatur']",set(),N
129,"Still, administrators should not rely solely on anti-virus software for detecting  infections.","['still', 'administr', 'reli', 'sole', 'softwar', 'detect', 'infect']",set(),N
130,"Logs from firewalls, intrusion detection and prevention sensors, and servers should be  monitored for signs of infections.","['log', 'firewal', 'intrus', 'detect', 'prevent', 'sensor', 'server', 'monitor', 'sign', 'infect']",set(),N
131,Incident response plans are a critical yet underutilized component of emergency preparedness and  resilience.,"['incid', 'respons', 'plan', 'critic', 'yet', 'underutil', 'compon', 'emerg', 'prepared', 'resili']",set(),N
132,"An effective cybersecurity response plan will limit damage, increase the confidence of  partners and customers, and reduce recovery time and costs.","['effect', 'cybersecur', 'respons', 'plan', 'limit', 'damag', 'increas', 'confid', 'partner', 'custom', 'reduc', 'recoveri', 'time', 'cost']",{'cybersecur'},Y
133,Plans should include measures for  reacting to destructive malware in an ICS environment.,"['plan', 'includ', 'measur', 'react', 'destruct', 'malwar', 'ic', 'environ']","{'measur', 'includ'}",Y
134,"In such situations, organizations should be  prepared to “island” their ICS environments by disconnecting from non-ICS networks.","['situat', 'organ', 'prepar', 'island', 'ic', 'environ', 'disconnect', 'network']","{'organ', 'network'}",Y
135,"They should also  be capable of going to “manual operations” if network conditions impact visibility from the SCADA  system, or if malware potentially renders control devices inoperable via an automated means.","['also', 'capabl', 'go', 'manual', 'oper', 'network', 'condit', 'impact', 'visibl', 'scada', 'system', 'malwar', 'potenti', 'render', 'control', 'devic', 'inoper', 'via', 'autom', 'mean']","{'control', 'network', 'devic'}",Y
136,"Rather than being developed by a single entity, the plan should be a product of collaboration between  all departments that would be stakeholders in a cybersecurity incident.","['rather', 'develop', 'singl', 'entiti', 'plan', 'product', 'collabor', 'depart', 'would', 'stakehold', 'cybersecur', 'incid']","{'develop', 'cybersecur'}",Y
137,This will ensure a cooperative  and unified response that leverages all of an organization’s resources to the greatest extent possible.,"['ensur', 'cooper', 'unifi', 'respons', 'leverag', 'organ', 'resourc', 'greatest', 'extent', 'possibl']",{'organ'},Y
138,"For enhanced responsive capability in the event of a cybersecurity incident, organizations should  consider forming a Computer Security Incident Response Team (CSIRT).","['enhanc', 'respons', 'capabl', 'event', 'cybersecur', 'incid', 'organ', 'consid', 'form', 'comput', 'secur', 'incid', 'respons', 'team', 'csirt']","{'secur', 'organ', 'cybersecur'}",Y
139,This task is not complete once the plan has been developed; it needs to be operationalized as well.,"['task', 'complet', 'plan', 'develop', 'need', 'operation', 'well']",{'develop'},Y
140,It is  critical that plans be routinely reviewed and updated to ensure they remain relevant and useable for  when they are actually needed.,"['critic', 'plan', 'routin', 'review', 'updat', 'ensur', 'remain', 'relev', 'useabl', 'actual', 'need']",set(),N
141,"Furthermore, to truly understand their cybersecurity incident response  plan, organizations must practice them through regular exercises.","['furthermor', 'truli', 'understand', 'cybersecur', 'incid', 'respons', 'plan', 'organ', 'must', 'practic', 'regular', 'exercis']","{'practic', 'organ', 'cybersecur'}",Y
142,"This will ensure that all stakeholders  understand the procedures that would be implemented in the event of a significant cyber disruption  or breach, enabling a more effective and efficient response.","['ensur', 'stakehold', 'understand', 'procedur', 'would', 'implement', 'event', 'signific', 'cyber', 'disrupt', 'breach', 'enabl', 'effect', 'effici', 'respons']","{'implement', 'cyber'}",Y
143,?,[],set(),N
144,Malware Threats and Mitigation Strategies (US-CERT)  ?,"['malwar', 'threat', 'mitig', 'strategi']",set(),N
145,Developing an ICS Cybersecurity Incident Response Capability (ICS-CERT)  ?,"['develop', 'ic', 'cybersecur', 'incid', 'respons', 'capabl']","{'develop', 'cybersecur'}",Y
146,Ten Steps to Planning an Effective Cyber-Incident Response (Harvard Business Review)  ?,"['ten', 'step', 'plan', 'effect', 'respons', 'harvard', 'busi', 'review']",set(),N
147,Create a CSIRT (CERT)  ?,"['creat', 'csirt', 'cert']",set(),N
148,"Best Practices for Continuity of Operations (ICS-CERT)        Cyber Security Standards  Karen Scarfone, Dan Benigni and Tim Grance  National Institute of Standards and Technology (NIST), Gaithersburg, Maryland    Abstract: The goal of cyber security standards is to improve the security of information technology (IT) systems,  networks, and critical infrastructures.","['best', 'practic', 'continu', 'oper', 'cyber', 'secur', 'standard', 'karen', 'scarfon', 'dan', 'benigni', 'tim', 'granc', 'nation', 'institut', 'standard', 'technolog', 'nist', 'gaithersburg', 'maryland', 'abstract', 'goal', 'cyber', 'secur', 'standard', 'improv', 'secur', 'inform', 'technolog', 'system', 'network', 'critic', 'infrastructur']","{'network', 'inform', 'technolog', 'standard', 'practic', 'cyber', 'secur'}",Y
149,"A cyber security standard defines both functional and assurance requirements  within a product, system, process, or technology environment.","['cyber', 'secur', 'standard', 'defin', 'function', 'assur', 'requir', 'within', 'product', 'system', 'process', 'technolog', 'environ']","{'technolog', 'requir', 'standard', 'cyber', 'secur'}",Y
150,Well-developed cyber security standards enable  consistency among product developers and serve as a reliable metric for purchasing security products.,"['cyber', 'secur', 'standard', 'enabl', 'consist', 'among', 'product', 'develop', 'serv', 'reliabl', 'metric', 'purchas', 'secur', 'product']","{'secur', 'develop', 'cyber', 'standard'}",Y
151,"Cyber security standards cover a broad range of granularity, from the mathematical definition of a cryptographic  algorithm to the specification of security features in a web browser, and are typically implementation independent.","['cyber', 'secur', 'standard', 'cover', 'broad', 'rang', 'granular', 'mathemat', 'definit', 'cryptograph', 'algorithm', 'specif', 'secur', 'featur', 'web', 'browser', 'typic', 'implement', 'independ']","{'secur', 'implement', 'cyber', 'standard'}",Y
152,"A standard must address user needs, but must also be practical since cost and technological limitations must be  considered in building products to meet the standard.","['standard', 'must', 'address', 'user', 'need', 'must', 'also', 'practic', 'sinc', 'cost', 'technolog', 'limit', 'must', 'consid', 'build', 'product', 'meet', 'standard']","{'practic', 'technolog', 'standard'}",Y
153,"Additionally, a standard’s requirements must be verifiable;  otherwise, users cannot assess security even when products are tested against the standard.","['addit', 'standard', 'requir', 'must', 'verifi', 'otherwis', 'user', 'assess', 'secur', 'even', 'product', 'test', 'standard']","{'secur', 'requir', 'standard'}",Y
154,"Keywords: cyber security; information technology; standards; standardization    The International Organization for Standardization (ISO) defines a standard as “a document, established by  consensus and approved by a recognized body, that provides, for common and repeated use, rules, guidelines, or  characteristics for activities or their results, aimed at the achievement of the optimum degree of order in a given  context” [1].","['keyword', 'cyber', 'secur', 'inform', 'technolog', 'standard', 'standard', 'intern', 'organ', 'standard', 'iso', 'defin', 'standard', 'document', 'establish', 'consensu', 'approv', 'recogn', 'bodi', 'provid', 'common', 'repeat', 'use', 'rule', 'guidelin', 'characterist', 'activ', 'result', 'aim', 'achiev', 'optimum', 'degre', 'order', 'given', 'context']","{'organ', 'inform', 'technolog', 'standard', 'intern', 'cyber', 'secur'}",Y
