No.,Sentence,StemWords,MatchWords,Use
0,"                        10 Basic Cybersecurity Measures   Best Practices to Reduce Exploitable      Weaknesses and Attacks      June 2015                                               Developed in partnership with the U.S. Department of Homeland Security Industrial Control Systems  Cyber Emergency Response Team (ICS-CERT), the FBI, and the Information Technology ISAC.","['basic', 'cybersecur', 'measur', 'best', 'practic', 'reduc', 'exploit', 'weak', 'attack', 'june', 'develop', 'partnership', 'depart', 'homeland', 'secur', 'industri', 'control', 'system', 'cyber', 'emerg', 'respons', 'team', 'fbi', 'inform', 'technolog', 'isac']","{'industri', 'control', 'inform', 'technolog', 'practic', 'measur', 'develop', 'cyber', 'secur', 'cybersecur'}",Y
1,WaterISAC also acknowledges the Multi-State ISAC for its contributions to this document.,"['waterisac', 'also', 'acknowledg', 'isac', 'contribut', 'document']",{'waterisac'},Y
2,"© WaterISAC 2015   10 Basic Cybersecurity Measures   i   About WaterISAC   The Water Information Sharing and Analysis Center, established in 2002 by the water and wastewater  industry, is the designated communications and operations arm of the United States water and wastewater  sector.","['waterisac', 'basic', 'cybersecur', 'measur', 'waterisac', 'water', 'inform', 'share', 'analysi', 'center', 'establish', 'water', 'wastewat', 'industri', 'design', 'commun', 'oper', 'arm', 'unit', 'state', 'water', 'wastewat', 'sector']","{'industri', 'inform', 'waterisac', 'measur', 'cybersecur'}",Y
3,"With an all-hazards focus, WaterISAC provides its members with threat alerts and analysis as well as  best practices and training on reducing risk, mitigating vulnerabilities, improving resiliency, and recovering  from natural and manmade emergencies.","['focu', 'waterisac', 'provid', 'member', 'threat', 'alert', 'analysi', 'well', 'best', 'practic', 'train', 'reduc', 'risk', 'mitig', 'vulner', 'improv', 'resili', 'recov', 'natur', 'manmad', 'emerg']","{'practic', 'waterisac'}",Y
4,"WaterISAC members are in the U.S., Canada, and Australia.","['waterisac', 'member', 'canada', 'australia']",{'waterisac'},Y
5,"They include water and wastewater utilities;  federal, state, and local government agencies involved in security, law enforcement, intelligence analysis,  emergency response, and public health; and engineering and consulting firms.","['includ', 'water', 'wastewat', 'util', 'feder', 'state', 'local', 'govern', 'agenc', 'involv', 'secur', 'law', 'enforc', 'intellig', 'analysi', 'emerg', 'respons', 'public', 'health', 'engin', 'consult', 'firm']","{'secur', 'includ'}",Y
6,"WaterISAC members have access to the world’s largest and richest source of information and tools for  strengthening water and wastewater utility security, resilience, and emergency management.","['waterisac', 'member', 'access', 'world', 'largest', 'richest', 'sourc', 'inform', 'tool', 'strengthen', 'water', 'wastewat', 'util', 'secur', 'resili', 'emerg', 'manag']","{'inform', 'waterisac', 'manag', 'secur', 'access'}",Y
7,"For more information about WaterISAC, visit https://www.waterisac.org or email service@waterisac.org.","['inform', 'waterisac', 'visit', 'http', 'email', 'servic']","{'inform', 'waterisac'}",Y
8,"If your organization has experienced a cybersecurity breach or suspects a breach has occurred, please contact  WaterISAC and ICS-CERT:   WaterISAC  Email: analyst@waterisac.org  Call: 866-H20-ISAC  Online Incident Report form: https://www.waterisac.org/report-incident   ICS-CERT  Email: ics-cert@hq.dhs.gov   Call: 877-776-7585                           WaterISAC     June 2015   10 Basic Cybersecurity Measures   ii   Introduction   In partnership with the U.S. Department of Homeland Security Industrial Control Systems Cyber  Emergency Response Team (ICS-CERT), the FBI, and the Information Technology ISAC, WaterISAC has  developed a list of 10 basic cybersecurity recommendations water and wastewater utilities can use to  reduce exploitable weaknesses and defend against avoidable data breaches and cyber attacks.","['organ', 'experienc', 'cybersecur', 'breach', 'suspect', 'breach', 'occur', 'pleas', 'contact', 'waterisac', 'waterisac', 'email', 'analyst', 'call', 'onlin', 'incid', 'report', 'form', 'http', 'email', 'call', 'waterisac', 'june', 'basic', 'cybersecur', 'measur', 'ii', 'introduct', 'partnership', 'depart', 'homeland', 'secur', 'industri', 'control', 'system', 'cyber', 'emerg', 'respons', 'team', 'fbi', 'inform', 'technolog', 'isac', 'waterisac', 'develop', 'list', 'basic', 'cybersecur', 'recommend', 'water', 'wastewat', 'util', 'use', 'reduc', 'exploit', 'weak', 'defend', 'avoid', 'data', 'breach', 'cyber', 'attack']","{'industri', 'organ', 'waterisac', 'control', 'inform', 'technolog', 'measur', 'cyber', 'develop', 'secur', 'cybersecur'}",Y
9,Each  recommendation is accompanied by links to corresponding technical resources.,"['recommend', 'accompani', 'link', 'correspond', 'technic', 'resourc']",set(),N
10,This document is an  updated version of the 10 Basic Cybersecurity Measures to Reduce Exploitable Weaknesses and Attacks  guide that WaterISAC published in August 2012.,"['document', 'updat', 'version', 'basic', 'cybersecur', 'measur', 'reduc', 'exploit', 'weak', 'attack', 'guid', 'waterisac', 'publish', 'august']","{'measur', 'waterisac', 'cybersecur'}",Y
11,"In reviewing its incident reports for 2014, ICS-CERT noted that implementation of the first three  recommendations likely would have detected the issues, prevented the vulnerabilities, and averted the  resulting impacts related to those incidents.","['review', 'incid', 'report', 'note', 'implement', 'first', 'three', 'recommend', 'like', 'would', 'detect', 'issu', 'prevent', 'vulner', 'avert', 'result', 'impact', 'relat', 'incid']",{'implement'},Y
12,"Although risks remain and threat actors will continue to  change their capabilities and methods, ICS-CERT advises that the first three recommendations be  implemented as soon as practical.","['although', 'risk', 'remain', 'threat', 'actor', 'continu', 'chang', 'capabl', 'method', 'advis', 'first', 'three', 'recommend', 'implement', 'soon', 'practic']","{'practic', 'implement'}",Y
13,"For further measures to reduce cyber risks, consult the Framework for Improving Critical Infrastructure  Cybersecurity by the National Institute of Standards and Technology (NIST) and the American Water  Works Association’s (AWWA’s) Cybersecurity Guidance and Tool.","['measur', 'reduc', 'cyber', 'risk', 'consult', 'framework', 'improv', 'critic', 'infrastructur', 'cybersecur', 'nation', 'institut', 'standard', 'technolog', 'nist', 'american', 'water', 'work', 'associ', 'awwa', 'cybersecur', 'guidanc', 'tool']","{'work', 'technolog', 'standard', 'measur', 'cyber', 'cybersecur'}",Y
14,"The NIST Cybersecurity Framework is  a set of voluntary practices, standards, and guidelines created to help critical infrastructure owners and  operators manage cyber risks.","['nist', 'cybersecur', 'framework', 'set', 'voluntari', 'practic', 'standard', 'guidelin', 'creat', 'help', 'critic', 'infrastructur', 'owner', 'oper', 'manag', 'cyber', 'risk']","{'standard', 'practic', 'manag', 'cyber', 'cybersecur'}",Y
15,The AWWA Guidance and Tool is a sector-specific approach for adopting  the NIST Cybersecurity Framework.,"['awwa', 'guidanc', 'tool', 'approach', 'adopt', 'nist', 'cybersecur', 'framework']",{'cybersecur'},Y
16,"Also, download WaterISAC’s Cybersecurity Resource Guide for more information on key resources to  help water and wastewater utilities and the government agencies that support them mitigate risks and  resolve vulnerabilities.","['also', 'download', 'waterisac', 'cybersecur', 'resourc', 'guid', 'inform', 'key', 'resourc', 'help', 'water', 'wastewat', 'util', 'govern', 'agenc', 'support', 'mitig', 'risk', 'resolv', 'vulner']","{'inform', 'waterisac', 'cybersecur'}",Y
17,WaterISAC     June 2015   10 Basic Cybersecurity Measures   1   1)  Maintain an Accurate Inventory of Control System Devices and Eliminate Any Exposure of   this Equipment to External Networks   Never allow any machine on the control network to talk directly to a machine on the business  network or on the Internet.,"['waterisac', 'june', 'basic', 'cybersecur', 'measur', 'maintain', 'accur', 'inventori', 'control', 'system', 'devic', 'elimin', 'exposur', 'equip', 'extern', 'network', 'never', 'allow', 'machin', 'control', 'network', 'talk', 'directli', 'machin', 'busi', 'network', 'internet']","{'control', 'waterisac', 'network', 'internet', 'measur', 'devic', 'cybersecur'}",Y
18,"Although some organizations’ industrial control systems may not  directly face the Internet, a connection still exists if those systems are connected to a part of the  network – such as the corporate side – that has a communications channel to external (non- trusted) resources (i.e., to the Internet).","['although', 'organ', 'industri', 'control', 'system', 'may', 'directli', 'face', 'internet', 'connect', 'still', 'exist', 'system', 'connect', 'part', 'network', 'corpor', 'side', 'commun', 'channel', 'extern', 'trust', 'resourc', 'internet']","{'industri', 'control', 'network', 'internet', 'organ'}",Y
19,"Organizations may not realize this connection exists, but a persistent cyber threat actor can find  such pathways and use them to access and exploit industrial control systems to attempt to create a  physical consequence.","['organ', 'may', 'realiz', 'connect', 'exist', 'persist', 'cyber', 'threat', 'actor', 'find', 'pathway', 'use', 'access', 'exploit', 'industri', 'control', 'system', 'attempt', 'creat', 'physic', 'consequ']","{'industri', 'control', 'cyber', 'organ', 'access'}",Y
20,"Therefore, organizations are encouraged to conduct thorough assessments  of their systems, including the corporate enterprise segments, to determine where pathways exist.","['therefor', 'organ', 'encourag', 'conduct', 'thorough', 'assess', 'system', 'includ', 'corpor', 'enterpris', 'segment', 'determin', 'pathway', 'exist']","{'organ', 'includ'}",Y
21,Any channels between devices on the control system and equipment on other networks should be  eliminated to reduce network vulnerabilities.,"['channel', 'devic', 'control', 'system', 'equip', 'network', 'elimin', 'reduc', 'network', 'vulner']","{'network', 'control', 'devic'}",Y
22,ICS-ALERT-12-046-01A Increasing Threat to Industrial Control Systems (ICS-CERT)  ICS-ALERT-11-343-01A Control System Internet Accessibility (ICS-CERT)   ?,"['increas', 'threat', 'industri', 'control', 'system', 'control', 'system', 'internet', 'access']","{'internet', 'industri', 'control', 'access'}",Y
23,?,[],set(),N
24,?,[],set(),N
25,"Targeted Cyber Intrusion Detection and Mitigation Strategies (ICS-CERT)      2)  Implement Network Segmentation and Apply Firewalls   Network segmentation entails classifying and categorizing IT assets, data, and personnel into  specific groups, and then restricting access to these groups.","['target', 'cyber', 'intrus', 'detect', 'mitig', 'strategi', 'implement', 'network', 'segment', 'appli', 'firewal', 'network', 'segment', 'entail', 'classifi', 'categor', 'asset', 'data', 'personnel', 'specif', 'group', 'restrict', 'access', 'group']","{'group', 'network', 'implement', 'cyber', 'access'}",Y
26,"By placing resources into different  areas of a network, a compromise of one device or sector cannot translate into the exploitation of  the entire system.","['place', 'resourc', 'differ', 'area', 'network', 'compromis', 'one', 'devic', 'sector', 'translat', 'exploit', 'entir', 'system']","{'network', 'devic'}",Y
27,"Otherwise, cyber threat actors would be able to exploit any vulnerability within  an organization’s system – the “weakest chain in the link” – to gain entry and move laterally  throughout a network and access sensitive equipment and data.","['otherwis', 'cyber', 'threat', 'actor', 'would', 'abl', 'exploit', 'vulner', 'within', 'organ', 'system', 'weakest', 'chain', 'link', 'gain', 'entri', 'move', 'later', 'throughout', 'network', 'access', 'sensit', 'equip', 'data']","{'organ', 'cyber', 'access', 'network'}",Y
28,"Given the rise of the “Internet of  Things” – whereby many previously non-Internet connected devices, such as video cameras, are  now linked to systems and the web – the importance of segmenting networks is greater than ever.","['given', 'rise', 'internet', 'thing', 'wherebi', 'mani', 'previous', 'connect', 'devic', 'video', 'camera', 'link', 'system', 'web', 'import', 'segment', 'network', 'greater', 'ever']","{'internet', 'network', 'devic'}",Y
29,"Access to network areas can be restricted by isolating them entirely from one another, which is  optimal in the case of industrial control systems (as described in recommendation #1 above), or by  implementing firewalls.","['access', 'network', 'area', 'restrict', 'isol', 'entir', 'one', 'anoth', 'optim', 'case', 'industri', 'control', 'system', 'describ', 'recommend', 'implement', 'firewal']","{'industri', 'control', 'network', 'implement', 'access'}",Y
30,A firewall is a software program or hardware device that filters the inbound  and outbound traffic between different parts of a network or between a network and the Internet.,"['firewal', 'softwar', 'program', 'hardwar', 'devic', 'filter', 'inbound', 'outbound', 'traffic', 'differ', 'part', 'network', 'network', 'internet']","{'internet', 'network', 'devic'}",Y
31,"For connections that face the Internet, a firewall can be set up to filter incoming and outgoing  information.","['connect', 'face', 'internet', 'firewal', 'set', 'filter', 'incom', 'outgo', 'inform']","{'internet', 'inform'}",Y
32,"By reducing the number of pathways into and within your networks and by implementing  security protocols on the pathways that do exist, it is much more difficult for a threat to enter your  system and gain access to other areas.","['reduc', 'number', 'pathway', 'within', 'network', 'implement', 'secur', 'protocol', 'pathway', 'exist', 'much', 'difficult', 'threat', 'enter', 'system', 'gain', 'access', 'area']","{'secur', 'implement', 'network', 'access'}",Y
33,Creating network boundaries and segments empowers an organization to enforce both detective and  protective controls within its infrastructure.,"['creat', 'network', 'boundari', 'segment', 'empow', 'organ', 'enforc', 'detect', 'protect', 'control', 'within', 'infrastructur']","{'organ', 'control', 'network'}",Y
34,"The capability to monitor, restrict, and govern  communication flows yields to a practical capability to baseline network traffic (especially traffic  traversing a network boundary), and identify anomalous or suspicious communication flows.","['capabl', 'monitor', 'restrict', 'govern', 'commun', 'flow', 'yield', 'practic', 'capabl', 'baselin', 'network', 'traffic', 'especi', 'traffic', 'travers', 'network', 'boundari', 'identifi', 'anomal', 'suspici', 'commun', 'flow']","{'practic', 'network'}",Y
35,"WaterISAC     June 2015   10 Basic Cybersecurity Measures   2   These boundaries also provide a means to practically detect potential lateral movement, network  footprinting and enumeration, and device communications attempting to traverse from one zone to  another.","['waterisac', 'june', 'basic', 'cybersecur', 'measur', 'boundari', 'also', 'provid', 'mean', 'practic', 'detect', 'potenti', 'later', 'movement', 'network', 'footprint', 'enumer', 'devic', 'commun', 'attempt', 'travers', 'one', 'zone', 'anoth']","{'network', 'waterisac', 'practic', 'measur', 'devic', 'cybersecur'}",Y
36,?,[],set(),N
37,Improving Industrial Control Systems Cybersecurity with Defense-In-Depth Strategies (ICS- CERT)   ?,"['improv', 'industri', 'control', 'system', 'cybersecur', 'strategi', 'cert']","{'industri', 'control', 'cybersecur'}",Y
38,Why You Need to Segment Your Network for Security (CSO)  ?,"['need', 'segment', 'network', 'secur', 'cso']","{'secur', 'network'}",Y
39,Firewall Deployment for SCADA and Process Control Networks (UK Centre for the   Protection of National Infrastructure via ICS-CERT)   ?,"['firewal', 'deploy', 'scada', 'process', 'control', 'network', 'uk', 'centr', 'protect', 'nation', 'infrastructur', 'via']","{'control', 'network'}",Y
40,Beginners Guide to Firewalls: A Non-Technical Guide (MS-ISAC)  ?,"['beginn', 'guid', 'firewal', 'guid']",set(),N
41,"Guide to Industrial Control Systems Security – Special Publication 800-82 (NIST)      3)  Use Secure Remote Access Methods   The ability to remotely connect to a network has added a great deal of convenience for end users,  but a secure access method, such as a Virtual Private Network (VPN), should be used if remote  access is required.","['guid', 'industri', 'control', 'system', 'secur', 'special', 'public', 'nist', 'use', 'secur', 'remot', 'access', 'method', 'abil', 'remot', 'connect', 'network', 'ad', 'great', 'deal', 'conveni', 'end', 'user', 'secur', 'access', 'method', 'virtual', 'privat', 'network', 'vpn', 'use', 'remot', 'access', 'requir']","{'industri', 'network', 'control', 'requir', 'secur', 'access'}",Y
42,A VPN is an encrypted data channel for securely sending and receiving data via  public IT infrastructure (such as the Internet).,"['vpn', 'encrypt', 'data', 'channel', 'secur', 'send', 'receiv', 'data', 'via', 'public', 'infrastructur', 'internet']","{'internet', 'secur'}",Y
43,"Through a VPN, users are able to remotely access  internal resources like files, printers, databases, or websites as if directly connected to the network.","['vpn', 'user', 'abl', 'remot', 'access', 'intern', 'resourc', 'like', 'file', 'printer', 'databas', 'websit', 'directli', 'connect', 'network']","{'network', 'intern', 'access'}",Y
44,This remote access can further be hardened by reducing the number of Internet Protocol (IP)  addresses that can access it by utilizing network devices and/or firewalls to specific IP addresses  and/or ranges and from within the U.S.,"['remot', 'access', 'harden', 'reduc', 'number', 'internet', 'protocol', 'ip', 'address', 'access', 'util', 'network', 'devic', 'firewal', 'specif', 'ip', 'address', 'rang', 'within']","{'internet', 'network', 'devic', 'access'}",Y
45,Note that a VPN is only as secure as the devices connected  to it.,"['note', 'vpn', 'secur', 'devic', 'connect']","{'secur', 'devic'}",Y
46,"A laptop computer infected with malware can introduce those vulnerabilities into the network,  leading to additional infections and negating the security of the VPN.","['laptop', 'comput', 'infect', 'malwar', 'introduc', 'vulner', 'network', 'lead', 'addit', 'infect', 'negat', 'secur', 'vpn']","{'secur', 'network'}",Y
47,?,[],set(),N
48,Configuring and Managing Remote Access for Industrial Control Systems (ICS-CERT)  ?,"['configur', 'manag', 'remot', 'access', 'industri', 'control', 'system']","{'industri', 'manag', 'control', 'access'}",Y
49,Virtual Private Networking: An Overview (Microsoft)      4)  Establish Role-Based Access Controls and Implement System Logging   Role-based access control grants or denies access to network resources based on job functions.,"['virtual', 'privat', 'network', 'overview', 'microsoft', 'establish', 'access', 'control', 'implement', 'system', 'log', 'access', 'control', 'grant', 'deni', 'access', 'network', 'resourc', 'base', 'job', 'function']","{'control', 'network', 'access', 'implement'}",Y
50,This  limits the ability of individual users – or attackers – to reach files or parts of the system they  shouldn’t access.,"['limit', 'abil', 'individu', 'user', 'attack', 'reach', 'file', 'part', 'system', 'access']",{'access'},Y
51,"For example, SCADA system operators likely do not need access to the billing  department or certain administrative files.","['exampl', 'scada', 'system', 'oper', 'like', 'need', 'access', 'bill', 'depart', 'certain', 'administr', 'file']",{'access'},Y
52,"Therefore, define the permissions based on the level of  access each job function needs to perform its duties, and work with human resources to implement  standard operating  procedures to remove network access of former employees and contractors.","['therefor', 'defin', 'permiss', 'base', 'level', 'access', 'job', 'function', 'need', 'perform', 'duti', 'work', 'human', 'resourc', 'implement', 'standard', 'oper', 'procedur', 'remov', 'network', 'access', 'former', 'employe', 'contractor']","{'work', 'network', 'standard', 'implement', 'access'}",Y
53,"In  addition, limiting employee permissions through role-based access controls can facilitate tracking  network intrusions or suspicious activities during an audit.","['addit', 'limit', 'employe', 'permiss', 'access', 'control', 'facilit', 'track', 'network', 'intrus', 'suspici', 'activ', 'audit']","{'network', 'control', 'access'}",Y
54,Implementing a logging capability allows for the monitoring of system activity.,"['implement', 'log', 'capabl', 'allow', 'monitor', 'system', 'activ']",{'implement'},Y
55,"This enables  organizations to conduct thorough root cause analyses to find the sources of issues in the system,  which may have been the activities of an employee or an outsider.","['enabl', 'organ', 'conduct', 'thorough', 'root', 'caus', 'analys', 'find', 'sourc', 'issu', 'system', 'may', 'activ', 'employe', 'outsid']",{'organ'},Y
56,"Monitoring network traffic also  allows organizations to determine if a user is making unauthorized actions or if an outsider is in the  system, which provides an opportunity to intervene before problems are manifested.","['monitor', 'network', 'traffic', 'also', 'allow', 'organ', 'determin', 'user', 'make', 'unauthor', 'action', 'outsid', 'system', 'provid', 'opportun', 'interven', 'problem', 'manifest']","{'organ', 'network'}",Y
57,WaterISAC     June 2015   10 Basic Cybersecurity Measures   3   ?,"['waterisac', 'june', 'basic', 'cybersecur', 'measur']","{'measur', 'waterisac', 'cybersecur'}",Y
58,An Introduction to Role Based Access Control (NIST)  ?,"['introduct', 'role', 'base', 'access', 'control', 'nist']","{'control', 'access'}",Y
59,Extending Role Based Access Control (SANS Institute)  ?,"['extend', 'role', 'base', 'access', 'control', 'san', 'institut']","{'control', 'access'}",Y
60,"Targeted Cyber Intrusion Detection and Mitigation Strategies (ICS-CERT)      5)  Use Only Strong Passwords, Change Default Passwords, and Consider Other Access   Controls   Use strong passwords to keep your systems and information secure, and have different passwords  for different  accounts.","['target', 'cyber', 'intrus', 'detect', 'mitig', 'strategi', 'use', 'strong', 'password', 'chang', 'default', 'password', 'consid', 'access', 'control', 'use', 'strong', 'password', 'keep', 'system', 'inform', 'secur', 'differ', 'password', 'differ', 'account']","{'control', 'inform', 'cyber', 'secur', 'access'}",Y
61,"Hackers can use readily available software tools to try millions of character  combinations to attempt an unauthorized login – this is called a “brute force attack.” Passwords  should have at least eight characters, but longer passwords are stronger, because of the greater  number of characters to guess.","['hacker', 'use', 'readili', 'avail', 'softwar', 'tool', 'tri', 'million', 'charact', 'combin', 'attempt', 'unauthor', 'login', 'call', 'brute', 'forc', 'password', 'least', 'eight', 'charact', 'longer', 'password', 'stronger', 'greater', 'number', 'charact', 'guess']",set(),N
62,"Also, include uppercase and lowercase letters, numerals, and special  characters.","['also', 'includ', 'uppercas', 'lowercas', 'letter', 'numer', 'special', 'charact']",{'includ'},Y
63,"Change all default passwords upon installation of new software, particularly for  administrator accounts and control system devices, and regularly thereafter.","['chang', 'default', 'password', 'upon', 'instal', 'new', 'softwar', 'particularli', 'administr', 'account', 'control', 'system', 'devic', 'regularli', 'thereaft']","{'control', 'devic'}",Y
64,"Implement other  password security features, such as an account lock-out that activates when too many incorrect  passwords have been entered.","['implement', 'password', 'secur', 'featur', 'account', 'activ', 'mani', 'incorrect', 'password', 'enter']","{'secur', 'implement'}",Y
65,"Organizations may also consider requiring multi-factor  authentication, which entails users verifying their identities – via codes sent to devices they  previously registered – whenever they attempt to sign-in.","['organ', 'may', 'also', 'consid', 'requir', 'authent', 'entail', 'user', 'verifi', 'ident', 'via', 'code', 'sent', 'devic', 'previous', 'regist', 'whenev', 'attempt']","{'organ', 'devic', 'requir'}",Y
66,?,[],set(),N
67,Choosing and Protecting Passwords (US-CERT)  ?,"['choos', 'protect', 'password']",set(),N
68,Supplementing Passwords (US-CERT)  ?,"['supplement', 'password']",set(),N
69,Check Your Password – Is it Strong?,"['check', 'password', 'strong']",set(),N
70,(Microsoft)      6)  Maintain Awareness of Vulnerabilities and Implement Necessary Patches and Updates   Most vendors work diligently to develop patches for identified vulnerabilities.,"['microsoft', 'maintain', 'awar', 'vulner', 'implement', 'necessari', 'patch', 'updat', 'vendor', 'work', 'dilig', 'develop', 'patch', 'identifi', 'vulner']","{'work', 'implement', 'develop'}",Y
71,"But even after patches  and updates have been released, many systems remain vulnerable because organizations are either  unaware of or choose to not implement these fixes.","['even', 'patch', 'updat', 'releas', 'mani', 'system', 'remain', 'vulner', 'organ', 'either', 'unawar', 'choos', 'implement', 'fix']","{'organ', 'implement'}",Y
