No.,Sentence,StemWords,MatchWords,Use
155,"Numerous standards have been developed for cyber security to help organizations better manage  security risk, implement security controls that meet legal and regulatory requirements, and achieve performance and  cost benefits.","['numer', 'standard', 'develop', 'cyber', 'secur', 'help', 'organ', 'better', 'manag', 'secur', 'risk', 'implement', 'secur', 'control', 'meet', 'legal', 'regulatori', 'requir', 'achiev', 'perform', 'cost', 'benefit']","{'control', 'standard', 'requir', 'implement', 'manag', 'secur', 'develop', 'cyber', 'organ'}",Y
156,"This article provides an overview of cyber security standards in general and highlights some of the  major ongoing international, regional, national, industry, and government standards efforts.","['articl', 'provid', 'overview', 'cyber', 'secur', 'standard', 'gener', 'highlight', 'major', 'ongo', 'intern', 'region', 'nation', 'industri', 'govern', 'standard', 'effort']","{'industri', 'standard', 'intern', 'cyber', 'secur'}",Y
157,It also discusses the  advantages of having standards and explains how organizations can participate in standards research and  development.,"['also', 'discuss', 'advantag', 'standard', 'explain', 'organ', 'particip', 'standard', 'research', 'develop']","{'organ', 'develop', 'standard'}",Y
158,1 Cyber Security Standards Overview  Cyber security standards are proliferating.,"['cyber', 'secur', 'standard', 'overview', 'cyber', 'secur', 'standard', 'prolifer']","{'secur', 'cyber', 'standard'}",Y
159,Governments and businesses increasingly mandate their implementation.,"['govern', 'busi', 'increasingli', 'mandat', 'implement']",{'implement'},Y
160,More manufacturers and vendors are building and selling standards-compliant products and services.,"['manufactur', 'vendor', 'build', 'sell', 'product', 'servic']",set(),N
161,"In addition, a  growing number of organizations are becoming involved in standards development.","['addit', 'grow', 'number', 'organ', 'becom', 'involv', 'standard', 'develop']","{'organ', 'develop', 'standard'}",Y
162,Cyber security standards are  being embraced because they are useful.,"['cyber', 'secur', 'standard', 'embrac', 'use']","{'secur', 'cyber', 'standard'}",Y
163,They provide tangible benefits that justify the time and financial resources  required to produce and apply them.,"['provid', 'tangibl', 'benefit', 'justifi', 'time', 'financi', 'resourc', 'requir', 'produc', 'appli']",{'requir'},Y
164,"Security technology has not kept pace with the rapid development of IT, leaving systems, data, and users vulnerable  to both conventional and innovative security threats.","['secur', 'technolog', 'kept', 'pace', 'rapid', 'develop', 'leav', 'system', 'data', 'user', 'vulner', 'convent', 'innov', 'secur', 'threat']","{'secur', 'develop', 'technolog'}",Y
165,"Politically motivated adversaries, financially motivated  criminals, mischievous attackers, and malicious or careless authorized users are among the threats to systems and  technology that have the potential to jeopardize cyber security, US economic security, consumer identities and  privacy, and US public health and safety.","['polit', 'motiv', 'adversari', 'financi', 'motiv', 'crimin', 'mischiev', 'attack', 'malici', 'careless', 'author', 'user', 'among', 'threat', 'system', 'technolog', 'potenti', 'jeopard', 'cyber', 'secur', 'us', 'econom', 'secur', 'consum', 'ident', 'privaci', 'us', 'public', 'health', 'safeti']","{'secur', 'cyber', 'technolog'}",Y
166,"While it is impossible to eliminate all threats, improvements in cyber  security can help manage security risks by making it harder for attacks to succeed and by reducing the effect of  attacks that do occur.","['imposs', 'elimin', 'threat', 'improv', 'cyber', 'secur', 'help', 'manag', 'secur', 'risk', 'make', 'harder', 'attack', 'succeed', 'reduc', 'effect', 'attack', 'occur']","{'secur', 'manag', 'cyber'}",Y
167,Cyber security standards enhance security and contribute to risk management in several important ways.,"['cyber', 'secur', 'standard', 'enhanc', 'secur', 'contribut', 'risk', 'manag', 'sever', 'import', 'way']","{'secur', 'manag', 'cyber', 'standard'}",Y
168,Standards  help establish common security requirements and the capabilities needed for secure solutions.,"['standard', 'help', 'establish', 'common', 'secur', 'requir', 'capabl', 'need', 'secur', 'solut']","{'secur', 'requir', 'standard'}",Y
169,"For example, Federal  Information Processing Standards (FIPS) 140-2, Security Requirements for Cryptographic Modules, establishes  standard requirements for all cryptographic-based security systems used by federal organizations to protect sensitive  or valuable data [2].","['exampl', 'feder', 'inform', 'process', 'standard', 'fip', 'secur', 'requir', 'cryptograph', 'modul', 'establish', 'standard', 'requir', 'secur', 'system', 'use', 'feder', 'organ', 'protect', 'sensit', 'valuabl', 'data']","{'organ', 'inform', 'requir', 'standard', 'secur'}",Y
170,Conformance testing can then be performed against the standard to provide assurance to users  that cryptographic modules are built to requirements.,"['conform', 'test', 'perform', 'standard', 'provid', 'assur', 'user', 'cryptograph', 'modul', 'built', 'requir']","{'requir', 'standard'}",Y
171,"Security standards facilitate sharing of knowledge and best practices by helping to ensure common understanding of  concepts, terms, and definitions, which prevents errors.","['secur', 'standard', 'facilit', 'share', 'knowledg', 'best', 'practic', 'help', 'ensur', 'common', 'understand', 'concept', 'term', 'definit', 'prevent', 'error']","{'practic', 'secur', 'standard'}",Y
172,"For example, the Information and Communications  Technology (ICT) Security Standards Roadmap [3] includes references to several security glossaries, including the  ISO/IEC JTC1/SC27 IT Security Terminology publication [4].","['exampl', 'inform', 'commun', 'technolog', 'ict', 'secur', 'standard', 'roadmap', 'includ', 'refer', 'sever', 'secur', 'glossari', 'includ', 'secur', 'terminolog', 'public']","{'inform', 'technolog', 'standard', 'secur', 'includ'}",Y
173,"Other helpful resources include the Internet Security  Glossary from the Internet Engineering Task Force (IETF), Request for Comments (RFC) 4949 [5] and a  compendium of the International Telecommunications Union Telecommunication Standardization Sector (ITU-T)   approved security definitions [6].","['help', 'resourc', 'includ', 'internet', 'secur', 'glossari', 'internet', 'engin', 'task', 'forc', 'ietf', 'request', 'comment', 'rfc', 'compendium', 'intern', 'telecommun', 'union', 'telecommun', 'standard', 'sector', 'approv', 'secur', 'definit']","{'standard', 'internet', 'intern', 'secur', 'includ'}",Y
174,Using common definitions for security terminology saves time in the development  of new standards and supports the interoperability of standards.,"['use', 'common', 'definit', 'secur', 'terminolog', 'save', 'time', 'develop', 'new', 'standard', 'support', 'interoper', 'standard']","{'secur', 'develop', 'standard'}",Y
175,Cyber security standards also provide other benefits.,"['cyber', 'secur', 'standard', 'also', 'provid', 'benefit']","{'secur', 'cyber', 'standard'}",Y
176,"Because standards generally incorporate best practices and  conformance requirements, their use typically results in improvements in quality.","['standard', 'gener', 'incorpor', 'best', 'practic', 'conform', 'requir', 'use', 'typic', 'result', 'improv', 'qualiti']","{'practic', 'requir', 'standard'}",Y
177,Standards reduce the number of  technical variations and allow consumers easy access to interchangeable technology.,"['standard', 'reduc', 'number', 'technic', 'variat', 'allow', 'consum', 'easi', 'access', 'interchang', 'technolog']","{'technolog', 'access', 'standard'}",Y
178,"Standards compliance  programs offer a way to measure products and services against objective criteria and provide a basis for comparing  products, such as confirming that they offer certain sets of security features.","['standard', 'complianc', 'program', 'offer', 'way', 'measur', 'product', 'servic', 'object', 'criteria', 'provid', 'basi', 'compar', 'product', 'confirm', 'offer', 'certain', 'set', 'secur', 'featur']","{'secur', 'measur', 'standard'}",Y
179,"Consumers often benefit from cost  savings that result from the development, manufacture, sales, and delivery of standards-based, interoperable  products and services.","['consum', 'often', 'benefit', 'cost', 'save', 'result', 'develop', 'manufactur', 'sale', 'deliveri', 'interoper', 'product', 'servic']",{'develop'},Y
180,"Another benefit of cyber security standards is that the standards development process, with its  typical practices of involving a wide range of subject-matter experts, prototyping, and incorporating conformity  assessment criteria and methodologies, helps ensure that standards are implementable and reflect recommended  practices.","['anoth', 'benefit', 'cyber', 'secur', 'standard', 'standard', 'develop', 'process', 'typic', 'practic', 'involv', 'wide', 'rang', 'expert', 'prototyp', 'incorpor', 'conform', 'assess', 'criteria', 'methodolog', 'help', 'ensur', 'standard', 'implement', 'reflect', 'recommend', 'practic']","{'standard', 'practic', 'implement', 'develop', 'cyber', 'secur'}",Y
181,Products or services that have been demonstrated to conform to IT security standards can then be expected  to offer more assurance than nonstandard products.,"['product', 'servic', 'demonstr', 'conform', 'secur', 'standard', 'expect', 'offer', 'assur', 'nonstandard', 'product']","{'secur', 'standard'}",Y
182,"When security standards are not available for a technology, several problems often occur.","['secur', 'standard', 'avail', 'technolog', 'sever', 'problem', 'often', 'occur']","{'secur', 'technolog', 'standard'}",Y
183,Organizations that adopt  the technology may not be aware of its inherent security weaknesses and the implications of implementing the  technology for the organization’s security posture.,"['organ', 'adopt', 'technolog', 'may', 'awar', 'inher', 'secur', 'weak', 'implic', 'implement', 'technolog', 'organ', 'secur', 'postur']","{'secur', 'organ', 'implement', 'technolog'}",Y
184,Organizations also may not have reliable information on how to  take advantage of the technology’s security capabilities or on what additional security controls may be needed to  compensate for weaknesses in those capabilities.,"['organ', 'also', 'may', 'reliabl', 'inform', 'take', 'advantag', 'technolog', 'secur', 'capabl', 'addit', 'secur', 'control', 'may', 'need', 'compens', 'weak', 'capabl']","{'organ', 'control', 'inform', 'technolog', 'secur'}",Y
185,"This tends to lead to insecure implementations and insufficient  security maintenance, making systems more likely to be exploited and the organization more vulnerable to harm.","['tend', 'lead', 'insecur', 'implement', 'insuffici', 'secur', 'mainten', 'make', 'system', 'like', 'exploit', 'organ', 'vulner', 'harm']","{'secur', 'implement', 'organ'}",Y
186,1.1 Cyber Security Standards Characteristics  Standards can be defined as widely used rules or specifications for activities or their results.,"['cyber', 'secur', 'standard', 'characterist', 'standard', 'defin', 'wide', 'use', 'rule', 'specif', 'activ', 'result']","{'secur', 'cyber', 'standard'}",Y
187,"Nevertheless, there are  often significant differences in how individual standards are developed and applied.","['nevertheless', 'often', 'signific', 'differ', 'individu', 'standard', 'develop', 'appli']","{'develop', 'standard'}",Y
188,These differences can help  determine how quickly and easily a new standard is embraced and thereby influence the continued use or demise of  alternatives.,"['differ', 'help', 'determin', 'quickli', 'easili', 'new', 'standard', 'embrac', 'therebi', 'influenc', 'continu', 'use', 'demis', 'altern']",{'standard'},Y
189,"As a result, standards are often described by the specific characteristics of their development and  intended application, including the development process used to produce the standard, the way in which the standard  is regulated, the applicability of the standard to different audiences, the availability of the standard to the public, and  the measurability of the standard.","['result', 'standard', 'often', 'describ', 'specif', 'characterist', 'develop', 'intend', 'applic', 'includ', 'develop', 'process', 'use', 'produc', 'standard', 'way', 'standard', 'regul', 'applic', 'standard', 'differ', 'audienc', 'avail', 'standard', 'public', 'measur', 'standard']","{'measur', 'develop', 'includ', 'standard'}",Y
190,Standards come into being in different ways.,"['standard', 'come', 'differ', 'way']",{'standard'},Y
191,Proprietary or company standards are developed by companies with  little or no participation by external parties.,"['proprietari', 'compani', 'standard', 'develop', 'compani', 'littl', 'particip', 'extern', 'parti']","{'develop', 'standard'}",Y
192,De facto standards are created through the informal adoption of  prevailing practices or norms.,"['de', 'facto', 'standard', 'creat', 'inform', 'adopt', 'prevail', 'practic', 'norm']","{'practic', 'inform', 'standard'}",Y
193,"The majority are voluntary standards developed through some form of voluntary  consensus process, in which stakeholders participate and agree.","['major', 'voluntari', 'standard', 'develop', 'form', 'voluntari', 'consensu', 'process', 'stakehold', 'particip', 'agre']","{'develop', 'standard'}",Y
194,"Some voluntary standards development efforts are  open to all interested parties, while others are restricted to specific groups or individuals, such as members of a  particular alliance or consortium.","['voluntari', 'standard', 'develop', 'effort', 'open', 'interest', 'parti', 'other', 'restrict', 'specif', 'group', 'individu', 'member', 'particular', 'allianc', 'consortium']","{'develop', 'group', 'standard'}",Y
195,Standards differ in the ways that they are regulated.,"['standard', 'differ', 'way', 'regul']",{'standard'},Y
196,"Compliance with standards may be optional, or a governing or  regulatory organization may make compliance a requirement.","['complianc', 'standard', 'may', 'option', 'govern', 'regulatori', 'organ', 'may', 'make', 'complianc', 'requir']","{'organ', 'requir', 'standard'}",Y
197,"Voluntary standards are generally called voluntary,  not only because they are created through volunteers’ efforts but also because they are intended for optional use,  although a regulating agency could adopt or mandate their use.","['voluntari', 'standard', 'gener', 'call', 'voluntari', 'creat', 'volunt', 'effort', 'also', 'intend', 'option', 'use', 'although', 'regul', 'agenc', 'could', 'adopt', 'mandat', 'use']",{'standard'},Y
198,Mandatory standards are standards whose use is  prescribed by a regulatory agency or implementing organization.,"['mandatori', 'standard', 'standard', 'whose', 'use', 'prescrib', 'regulatori', 'agenc', 'implement', 'organ']","{'organ', 'implement', 'standard'}",Y
199,Mandatory standards typically implement laws and  regulations.,"['mandatori', 'standard', 'typic', 'implement', 'law', 'regul']","{'implement', 'standard'}",Y
200,The audience to whom a standard applies depends upon the entity that develops or adopts it.,"['audienc', 'standard', 'appli', 'depend', 'upon', 'entiti', 'develop', 'adopt']","{'develop', 'standard'}",Y
201,"An international  standard is one that is adopted by an international standards development organization (SDO) and made available to  the public, such as ISO International Standards.","['intern', 'standard', 'one', 'adopt', 'intern', 'standard', 'develop', 'organ', 'sdo', 'made', 'avail', 'public', 'iso', 'intern', 'standard']","{'organ', 'develop', 'intern', 'standard'}",Y
202,"A regional standard is a standard adopted by several nations in a  particular geographic region, for example, European Committee for Standardization (CEN) standards.","['region', 'standard', 'standard', 'adopt', 'sever', 'nation', 'particular', 'geograph', 'region', 'exampl', 'european', 'committe', 'standard', 'cen', 'standard']",{'standard'},Y
203,A national  standard is a standard developed for use in a particular country either by a government entity or a national SDO.,"['nation', 'standard', 'standard', 'develop', 'use', 'particular', 'countri', 'either', 'govern', 'entiti', 'nation', 'sdo']","{'develop', 'standard'}",Y
204,A  national standard can also be an international standard that is adopted for use by an individual country.,"['nation', 'standard', 'also', 'intern', 'standard', 'adopt', 'use', 'individu', 'countri']","{'intern', 'standard'}",Y
205,Examples  include FIPS and American National Standards Institute (ANSI) standards in the United States and British Standards  Institution (BSI) Standards in the United Kingdom.,"['exampl', 'includ', 'fip', 'american', 'nation', 'standard', 'institut', 'ansi', 'standard', 'unit', 'state', 'british', 'standard', 'institut', 'bsi', 'standard', 'unit', 'kingdom']","{'includ', 'standard'}",Y
206,"An industry standard is one that has been adopted by a  particular industry for common use, for example, Security Industry Association (SIA) standards.","['industri', 'standard', 'one', 'adopt', 'particular', 'industri', 'common', 'use', 'exampl', 'secur', 'industri', 'associ', 'sia', 'standard']","{'secur', 'industri', 'standard'}",Y
207,"Finally, a company  standard, also known as a proprietary standard, is a standard developed and owned by a commercial entity that  specifies practices or conventions unique to that entity.","['final', 'compani', 'standard', 'also', 'known', 'proprietari', 'standard', 'standard', 'develop', 'own', 'commerci', 'entiti', 'specifi', 'practic', 'convent', 'uniqu', 'entiti']","{'practic', 'develop', 'standard'}",Y
208,Standards may or may not be freely accessible by everyone.,"['standard', 'may', 'may', 'freeli', 'access', 'everyon']","{'access', 'standard'}",Y
209,"By definition, open standards are publicly available,  but their developer may charge for copies.","['definit', 'open', 'standard', 'publicli', 'avail', 'develop', 'may', 'charg', 'copi']","{'develop', 'standard'}",Y
210,Examples of open standards that are available to the public for a fee are  ISO standards and standards developed by ANSI-accredited organizations.,"['exampl', 'open', 'standard', 'avail', 'public', 'fee', 'iso', 'standard', 'standard', 'develop', 'organ']","{'organ', 'develop', 'standard'}",Y
211,"A vendor who develops and owns a  proprietary standard may choose to make it available to promote interoperability and broaden the market, or choose  not to share it.","['vendor', 'develop', 'own', 'proprietari', 'standard', 'may', 'choos', 'make', 'avail', 'promot', 'interoper', 'broaden', 'market', 'choos', 'share']","{'develop', 'standard'}",Y
212,A growing number of standards require a demonstration of conformance.,"['grow', 'number', 'standard', 'requir', 'demonstr', 'conform']","{'requir', 'standard'}",Y
213,"A performance standard states  requirements in terms of required results with criteria for verifying conformance, but without stating the methods for  achieving required results.","['perform', 'standard', 'state', 'requir', 'term', 'requir', 'result', 'criteria', 'verifi', 'conform', 'without', 'state', 'method', 'achiev', 'requir', 'result']","{'requir', 'standard'}",Y
214,Examples of performance standards are the Federal Information Security Management  Act (FISMA) and the Health Insurance Portability and Accountability Act (HIPAA).,"['exampl', 'perform', 'standard', 'feder', 'inform', 'secur', 'manag', 'act', 'fisma', 'health', 'insur', 'portabl', 'account', 'act', 'hipaa']","{'secur', 'manag', 'inform', 'standard'}",Y
215,"A prescriptive standard  specifies design requirements, how a requirement is to be achieved, or how an item is to be constructed, but without  criteria for measuring the conformity of the results with specified requirements.","['prescript', 'standard', 'specifi', 'design', 'requir', 'requir', 'achiev', 'item', 'construct', 'without', 'criteria', 'measur', 'conform', 'result', 'specifi', 'requir']","{'measur', 'requir', 'standard'}",Y
216,An example of a prescriptive  standard is ISO/IEC 7810 on identification card physical construction.,"['exampl', 'prescript', 'standard', 'identif', 'card', 'physic', 'construct']",{'standard'},Y
217,The development and use of performance  standards are encouraged since they are less likely than prescriptive specifications to stand in the way of innovation.,"['develop', 'use', 'perform', 'standard', 'encourag', 'sinc', 'less', 'like', 'prescript', 'specif', 'stand', 'way', 'innov']","{'develop', 'standard'}",Y
218,"Still, prescriptive standards are sometimes more appropriate, particularly for describing test methods or procedures  or for defining standards to achieve interoperability.","['still', 'prescript', 'standard', 'sometim', 'appropri', 'particularli', 'describ', 'test', 'method', 'procedur', 'defin', 'standard', 'achiev', 'interoper']",{'standard'},Y
219,1.2 Cyber Security Standards Interaction  A standard is rarely applied in isolation.,"['cyber', 'secur', 'standard', 'interact', 'standard', 'rare', 'appli', 'isol']","{'secur', 'cyber', 'standard'}",Y
220,"When technologies, processes, and management practices are combined to  solve a business problem, multiple standards normally come into play.","['technolog', 'process', 'manag', 'practic', 'combin', 'solv', 'busi', 'problem', 'multipl', 'standard', 'normal', 'come', 'play']","{'practic', 'manag', 'technolog', 'standard'}",Y
221,"When components are integrated, each may  entail one or more technical or management standards.","['compon', 'integr', 'may', 'entail', 'one', 'technic', 'manag', 'standard']","{'manag', 'standard'}",Y
222,"For example, a given business solution is likely to involve a  variety of IT security configuration standards, such as networking, communications, and security management  standards.","['exampl', 'given', 'busi', 'solut', 'like', 'involv', 'varieti', 'secur', 'configur', 'standard', 'network', 'commun', 'secur', 'manag', 'standard']","{'secur', 'manag', 'network', 'standard'}",Y
223,Each standard imposes requirements that may or may not conflict with the requirements of other  standards.,"['standard', 'impos', 'requir', 'may', 'may', 'conflict', 'requir', 'standard']","{'requir', 'standard'}",Y
224,Standards can interact in several ways.,"['standard', 'interact', 'sever', 'way']",{'standard'},Y
225,"Some standards are complementary, which means that one standard supports  or reinforces the requirements of another.","['standard', 'complementari', 'mean', 'one', 'standard', 'support', 'reinforc', 'requir', 'anoth']","{'requir', 'standard'}",Y
226,"For example, ISO frequently publishes multipart standards that can be  considered complementary, where each part is a separately developed volume covering a different aspect of a central  issue.","['exampl', 'iso', 'frequent', 'publish', 'multipart', 'standard', 'consid', 'complementari', 'part', 'separ', 'develop', 'volum', 'cover', 'differ', 'aspect', 'central', 'issu']","{'develop', 'standard'}",Y
227,"Some standards may conflict with each other, which means that there are inconsistencies or contradictions  between standards, resulting in issues such as technological incompatibility or legal noncompliance.","['standard', 'may', 'conflict', 'mean', 'inconsist', 'contradict', 'standard', 'result', 'issu', 'technolog', 'incompat', 'legal', 'noncompli']","{'technolog', 'standard'}",Y
228,"Other standards  are discrete, which means that they have no direct effect on one another.","['standard', 'discret', 'mean', 'direct', 'effect', 'one', 'anoth']",{'standard'},Y
229,"There are also standards gaps, where there  is no formal standard developed for a particular area of security, although a guideline may exist.","['also', 'standard', 'gap', 'formal', 'standard', 'develop', 'particular', 'area', 'secur', 'although', 'guidelin', 'may', 'exist']","{'secur', 'develop', 'standard'}",Y
230,Standards gaps  typically occur when a technology is evolving so rapidly that standards development cannot keep pace.,"['standard', 'gap', 'typic', 'occur', 'technolog', 'evolv', 'rapidli', 'standard', 'develop', 'keep', 'pace']","{'develop', 'technolog', 'standard'}",Y
231,"In other  cases, a gap exists because consensus has not been reached on either the technology or the standard.","['case', 'gap', 'exist', 'consensu', 'reach', 'either', 'technolog', 'standard']","{'technolog', 'standard'}",Y
232,"1.3 Standards and Guidelines  Standards can be contrasted with another category of documents, generally referred to as guidelines.","['standard', 'guidelin', 'standard', 'contrast', 'anoth', 'categori', 'document', 'gener', 'refer', 'guidelin']",{'standard'},Y
233,"Both standards  and guidelines provide guidance aimed at enhancing cyber security, but guidelines usually lack the level of  consensus and formality associated with standards.","['standard', 'guidelin', 'provid', 'guidanc', 'aim', 'enhanc', 'cyber', 'secur', 'guidelin', 'usual', 'lack', 'level', 'consensu', 'formal', 'associ', 'standard']","{'secur', 'cyber', 'standard'}",Y
234,"Some standards, such as ANSI Standards and FIPS Publications,  are easily recognized because they include the term standard in their titles.","['standard', 'ansi', 'standard', 'fip', 'public', 'easili', 'recogn', 'includ', 'term', 'standard', 'titl']","{'includ', 'standard'}",Y
235,Others are harder to recognize.,"['other', 'harder', 'recogn']",set(),N
236,"For  example, standards issued by the International Telecommunications Union (ITU), an international standards  developer, are designated as Recommendations.","['exampl', 'standard', 'issu', 'intern', 'telecommun', 'union', 'itu', 'intern', 'standard', 'develop', 'design', 'recommend']","{'develop', 'intern', 'standard'}",Y
