No.,Sentence,StemWords,MatchWords,Use
0,"April 4, 2017   Cybersecurity in the Health Care  Sector: Strengthening Public-Private  Partnerships   Subcommittee on Oversight and Investigations, Committee on Energy and  Commerce, United States House of Representatives, One Hundred  Fifteenth Congress, First Session    HEARING CONTENTS:  Member Statements   Greg Walden  Chairman, Committee on Energy and Commerce  [View pdf]   Tim Murphy  Chairman, Subcommittee on Oversight and Investigations  [View pdf]   Witnesses   Denise Anderson  President, National Health Information Sharing and Analysis Center  [View pdf]   Michael McNeil  Global Product Security & Services Officer, Philips  [View pdf]   Terry Rice  Vice President, IT Risk Management & Chief Information Security Officer  Merck & Company, Inc.  [View pdf]   * Please Note: External links included in this compilation were functional at the time of its creation but are not maintained thereafter.","['april', 'cybersecur', 'health', 'care', 'sector', 'strengthen', 'partnership', 'subcommitte', 'oversight', 'investig', 'committe', 'energi', 'commerc', 'unit', 'state', 'hous', 'repres', 'one', 'hundr', 'fifteenth', 'congress', 'first', 'session', 'hear', 'content', 'member', 'statement', 'greg', 'walden', 'chairman', 'committe', 'energi', 'commerc', 'view', 'pdf', 'tim', 'murphi', 'chairman', 'subcommitte', 'oversight', 'investig', 'view', 'pdf', 'wit', 'denis', 'anderson', 'presid', 'nation', 'health', 'inform', 'share', 'analysi', 'center', 'view', 'pdf', 'michael', 'mcneil', 'global', 'product', 'secur', 'servic', 'offic', 'philip', 'view', 'pdf', 'terri', 'rice', 'vice', 'presid', 'risk', 'manag', 'chief', 'inform', 'secur', 'offic', 'merck', 'compani', 'view', 'pdf', 'pleas', 'note', 'extern', 'link', 'includ', 'compil', 'function', 'time', 'creation', 'maintain', 'thereaft']","{'inform', 'manag', 'secur', 'includ', 'cybersecur'}",Y
1,"This hearing compilation was prepared by the Homeland Security Digital Library,   Naval Postgraduate School, Center for Homeland Defense and Security.","['hear', 'compil', 'prepar', 'homeland', 'secur', 'digit', 'librari', 'naval', 'postgradu', 'school', 'center', 'homeland', 'defens', 'secur']",{'secur'},Y
2,Available Webcast(s)*:   [View Webcast]   Compiled From*:   https://energycommerce.house.gov/hearings-and-votes/hearings/cybersecurity- heath-care-sector-strengthening-public-private   * Please Note: External links included in this compilation were functional at the time of its creation but are not maintained thereafter.,"['avail', 'webcast', 'view', 'webcast', 'compil', 'http', 'pleas', 'note', 'extern', 'link', 'includ', 'compil', 'function', 'time', 'creation', 'maintain', 'thereaft']",{'includ'},Y
3,"This hearing compilation was prepared by the Homeland Security Digital Library,   Naval Postgraduate School, Center for Homeland Defense and Security.","['hear', 'compil', 'prepar', 'homeland', 'secur', 'digit', 'librari', 'naval', 'postgradu', 'school', 'center', 'homeland', 'defens', 'secur']",{'secur'},Y
4,"Opening Statement of Chairman Greg Walden  Subcommittee on Oversight and Investigations    Hearing on “Cybersecurity in the Health Care Sector: Strengthening   Public-Private Partnerships”   April 4, 2017   	     (As prepared for delivery)   	     We are well aware of the threats posed by our increasingly connected  society, but nowhere do these risks hit closer to home than on the very  technology we rely on for our own health care.","['open', 'statement', 'chairman', 'greg', 'walden', 'subcommitte', 'oversight', 'investig', 'hear', 'cybersecur', 'health', 'care', 'sector', 'strengthen', 'partnership', 'april', 'prepar', 'deliveri', 'well', 'awar', 'threat', 'pose', 'increasingli', 'connect', 'societi', 'nowher', 'risk', 'hit', 'closer', 'home', 'technolog', 'reli', 'health', 'care']","{'technolog', 'cybersecur'}",Y
5,"The threats range from  ransomware, breaches of patient data at heath care organizations, to the  vulnerabilities in pacemakers and other medical devices.","['threat', 'rang', 'ransomwar', 'breach', 'patient', 'data', 'heath', 'care', 'organ', 'vulner', 'pacemak', 'medic', 'devic']","{'organ', 'devic'}",Y
6,"Taken in  isolation, these and other threats pose serious challenges to health care  organizations.","['taken', 'isol', 'threat', 'pose', 'seriou', 'challeng', 'health', 'care', 'organ']",{'organ'},Y
7,"Collectively, they demonstrate the breadth, complexity,  and unavoidable nature of cyber threats in modern society – both now  and for the foreseeable future.","['collect', 'demonstr', 'breadth', 'complex', 'unavoid', 'natur', 'cyber', 'threat', 'modern', 'societi', 'forese', 'futur']",{'cyber'},Y
8,"As technology becomes increasingly integrated with all levels of our  health care, cyber threats pose a challenge to the entire sector.","['technolog', 'becom', 'increasingli', 'integr', 'level', 'health', 'care', 'cyber', 'threat', 'pose', 'challeng', 'entir', 'sector']","{'cyber', 'technolog'}",Y
9,"Everyone  - from the smallest rural hospitals, to large providers and device  manufacturers - faces some level of exposure and risk.","['everyon', 'smallest', 'rural', 'hospit', 'larg', 'provid', 'devic', 'manufactur', 'face', 'level', 'exposur', 'risk']",{'devic'},Y
10,"Breaches, exploits, and vulnerabilities are inevitable realities of modern  society, even for the most well-resourced and sophisticated  organizations.","['breach', 'exploit', 'vulner', 'inevit', 'realiti', 'modern', 'societi', 'even', 'sophist', 'organ']",{'organ'},Y
11,But this does not mean doom-and-gloom for everyone  with an internet connection.,"['mean', 'everyon', 'internet', 'connect']",{'internet'},Y
12,It is simply reality and must serve as the  baseline for any discussion about cybersecurity.,"['simpli', 'realiti', 'must', 'serv', 'baselin', 'discuss', 'cybersecur']",{'cybersecur'},Y
13,"We may not be able to  stop every attack, but as the threats continue to escalate, we must do  more to minimize the risk.","['may', 'abl', 'stop', 'everi', 'attack', 'threat', 'continu', 'escal', 'must', 'minim', 'risk']",set(),N
14,Improving security is a collective responsibility.,"['improv', 'secur', 'collect', 'respons']",{'secur'},Y
15,"When we work together  – government and private sector, large companies and small – we can do  more to improve security than if we attempt to solve it on our own.","['work', 'togeth', 'govern', 'privat', 'sector', 'larg', 'compani', 'small', 'improv', 'secur', 'attempt', 'solv']","{'secur', 'work'}",Y
16,An attack on one organization may be prevented elsewhere if we have  the infrastructure and mechanisms necessary to communicate effectively  with others across the sector.,"['attack', 'one', 'organ', 'may', 'prevent', 'elsewher', 'infrastructur', 'mechan', 'necessari', 'commun', 'effect', 'other', 'across', 'sector']",{'organ'},Y
17,"Further, if an event has widespread or  national implications, we need to coordinate an effective and efficient  response – with unity of effort, not confusion over roles and  responsibilities.","['event', 'widespread', 'nation', 'implic', 'need', 'coordin', 'effect', 'effici', 'respons', 'uniti', 'effort', 'confus', 'role', 'respons']",set(),N
18,"That is why, for almost two decades, the U.S. has worked to establish  public-private partnerships to coordinate security planning and  information sharing within and across our 16 critical infrastructure  sectors, which includes health care.","['almost', 'two', 'decad', 'work', 'establish', 'partnership', 'coordin', 'secur', 'plan', 'inform', 'share', 'within', 'across', 'critic', 'infrastructur', 'sector', 'includ', 'health', 'care']","{'secur', 'work', 'includ', 'inform'}",Y
19,"Effective collaboration between government and the private sector is  vital to elevating our security posture,.","['effect', 'collabor', 'govern', 'privat', 'sector', 'vital', 'elev', 'secur', 'postur']",{'secur'},Y
20,These partnerships provide a vital  link between those responsible for the safety and security of the nation  with those who own and operate the infrastructure critical to those  objectives.,"['partnership', 'provid', 'vital', 'link', 'respons', 'safeti', 'secur', 'nation', 'oper', 'infrastructur', 'critic', 'object']",{'secur'},Y
21,"To date, these public private partnerships have experienced mixed  results.","['date', 'public', 'privat', 'partnership', 'experienc', 'mix', 'result']",set(),N
22,Some sectors have been more successful than others in coming  together – both with private sector and government partners.,"['sector', 'success', 'other', 'come', 'togeth', 'privat', 'sector', 'govern', 'partner']",set(),N
23,"The health  care sector, in particular, has struggled to coalesce around these public- private partnerships for cybersecurity.","['health', 'care', 'sector', 'particular', 'struggl', 'coalesc', 'around', 'privat', 'partnership', 'cybersecur']",{'cybersecur'},Y
24,"It is this shared, goal that brings  us together today.","['share', 'goal', 'bring', 'us', 'togeth', 'today']",set(),N
25,This hearing marks an important opportunity to hear from our  distinguished panelists about what is necessary to bring the health care  sector together and continue building momentum in the right direction.,"['hear', 'mark', 'import', 'opportun', 'hear', 'distinguish', 'panelist', 'necessari', 'bring', 'health', 'care', 'sector', 'togeth', 'continu', 'build', 'momentum', 'right', 'direct']",set(),N
26,"Simply put, the cost of inaction is too great.","['simpli', 'put', 'cost', 'inact', 'great']",set(),N
27,"As the threats continue to  escalate, so too do our cybersecurity challenges.","['threat', 'continu', 'escal', 'cybersecur', 'challeng']",{'cybersecur'},Y
28,We’ve seen the  headlines – we know the attacks will continue.,"['seen', 'headlin', 'know', 'attack', 'continu']",set(),N
29,But today is about what  improvements can be made so we can be prepared for the inevitable.,"['today', 'improv', 'made', 'prepar', 'inevit']",set(),N
30,"Opening Statement of The Honorable Tim Murphy   Subcommittee on Oversight and Investigations   Hearing on “Cybersecurity in the Health Care Sector: Strengthening   Public-Private Partnerships”   April 4, 2017   We are here today to talk about cybersecurity in the health care sector.","['open', 'statement', 'honor', 'tim', 'murphi', 'subcommitte', 'oversight', 'investig', 'hear', 'cybersecur', 'health', 'care', 'sector', 'strengthen', 'partnership', 'april', 'today', 'talk', 'cybersecur', 'health', 'care', 'sector']",{'cybersecur'},Y
31,Strong cybersecurity practices are essential in this industry.,"['strong', 'cybersecur', 'practic', 'essenti', 'industri']","{'practic', 'industri', 'cybersecur'}",Y
32,This isn’t just about  protecting patient data or information – this is about patient safety.,"['protect', 'patient', 'data', 'inform', 'patient', 'safeti']",{'inform'},Y
33,"For nearly two decades, a cornerstone of the nation’s efforts to combat cyber  threats have been public-private partnerships designed to facilitate engagement and  collaboration between the government and private sector.","['nearli', 'two', 'decad', 'cornerston', 'nation', 'effort', 'combat', 'cyber', 'threat', 'partnership', 'design', 'facilit', 'engag', 'collabor', 'govern', 'privat', 'sector']",{'cyber'},Y
34,"Over time this model  has evolved, but the objective remains the same – unity of effort between those  responsible for protecting the nation and those who own and operate the  infrastructure that is critical to that mission.","['time', 'model', 'evolv', 'object', 'remain', 'uniti', 'effort', 'respons', 'protect', 'nation', 'oper', 'infrastructur', 'critic', 'mission']",set(),N
35,The focal point of these efforts are 16 critical infrastructure sectors—one of  which is the health care sector.,"['focal', 'point', 'effort', 'critic', 'infrastructur', 'health', 'care', 'sector']",set(),N
36,"Each sector is organized around several key  institutions – a Sector Specific Agency, Government Coordinating Council, Sector  Coordinating Council and Information Sharing and Analysis Center.","['sector', 'organ', 'around', 'sever', 'key', 'institut', 'sector', 'specif', 'agenc', 'govern', 'coordin', 'council', 'sector', 'coordin', 'council', 'inform', 'share', 'analysi', 'center']","{'organ', 'inform'}",Y
37,"Each of these  institutions plays an important role in ensuring participation, collaboration, and  unity of effort of the government and private sector participants within each sector.","['institut', 'play', 'import', 'role', 'ensur', 'particip', 'collabor', 'uniti', 'effort', 'govern', 'privat', 'sector', 'particip', 'within', 'sector']",set(),N
38,"Despite a number of efforts to improve this model over the years, it has  achieved mixed results across the various sectors.","['despit', 'number', 'effort', 'improv', 'model', 'year', 'achiev', 'mix', 'result', 'across', 'variou', 'sector']",set(),N
39,Some sectors have succeeded in  developing robust support and engagement with both government and industry  participants.,"['sector', 'succeed', 'develop', 'robust', 'support', 'engag', 'govern', 'industri', 'particip']","{'industri', 'develop'}",Y
40,"The gold standard, to date, has been the financial sector.","['gold', 'standard', 'date', 'financi', 'sector']",{'standard'},Y
41,"This sector enjoys  a strong, collaborative relationship with their government partner – the Department  of the Treasury – which is noteworthy because Treasury is also their regulator.","['sector', 'enjoy', 'strong', 'collabor', 'relationship', 'govern', 'partner', 'depart', 'treasuri', 'noteworthi', 'treasuri', 'also', 'regul']",set(),N
42,"In  addition, despite having a very diverse sector, they have succeeded in encouraging  support and participation from a wide variety of institutions – from small  community banks to large multi-national financial institutions.","['addit', 'despit', 'divers', 'sector', 'succeed', 'encourag', 'support', 'particip', 'wide', 'varieti', 'institut', 'small', 'commun', 'bank', 'larg', 'financi', 'institut']",set(),N
43,"This extensive  membership has helped the sector to establish the nation’s most sophisticated and  well-resourced ISAC, which improves its value to the entire sector.","['extens', 'membership', 'help', 'sector', 'establish', 'nation', 'sophist', 'isac', 'improv', 'valu', 'entir', 'sector']",set(),N
44,"Another, more recent, success story has been the electricity sector.","['anoth', 'recent', 'success', 'stori', 'electr', 'sector']",set(),N
45,This   sector has improved collaboration and engagement – both with government  partners at the Department of Energy and across private industry – through senior  executive participation on the sector coordinating council.,"['sector', 'improv', 'collabor', 'engag', 'govern', 'partner', 'depart', 'energi', 'across', 'privat', 'industri', 'senior', 'execut', 'particip', 'sector', 'coordin', 'council']",{'industri'},Y
46,"In addition to elevating  the priority for industry partners, it has improved coordination and unity of effort  with the government.","['addit', 'elev', 'prioriti', 'industri', 'partner', 'improv', 'coordin', 'uniti', 'effort', 'govern']",{'industri'},Y
47,"Despite the relative success of these and several others, every sector has  unique characteristics and challenges that influence the pace of adoption and  engagement in these institutions.","['despit', 'rel', 'success', 'sever', 'other', 'everi', 'sector', 'uniqu', 'characterist', 'challeng', 'influenc', 'pace', 'adopt', 'engag', 'institut']",set(),N
48,What works for one sector may not work for  others.,"['work', 'one', 'sector', 'may', 'work', 'other']",{'work'},Y
49,"As each sector figures out what works best for their participants, however,  the lessons from others should not be overlooked or ignored – especially for those  sectors that continue to evolve.","['sector', 'figur', 'work', 'best', 'particip', 'howev', 'lesson', 'other', 'overlook', 'ignor', 'especi', 'sector', 'continu', 'evolv']",{'work'},Y
50,Which brings us to the focus of today’s hearing – the health care sector.,"['bring', 'us', 'focu', 'today', 'hear', 'health', 'care', 'sector']",set(),N
51,"This sector has long struggled to coalesce around the public-private partnership  model, especially with respect to cybersecurity.","['sector', 'long', 'struggl', 'coalesc', 'around', 'partnership', 'model', 'especi', 'respect', 'cybersecur']",{'cybersecur'},Y
52,This may be partially attributable  to the fact that cybersecurity is a relatively new challenge for much of this sector.,"['may', 'partial', 'attribut', 'fact', 'cybersecur', 'rel', 'new', 'challeng', 'much', 'sector']",{'cybersecur'},Y
53,"However, as health care becomes increasingly digitized, the need to improve  cybersecurity must be a priority.","['howev', 'health', 'care', 'becom', 'increasingli', 'digit', 'need', 'improv', 'cybersecur', 'must', 'prioriti']",{'cybersecur'},Y
54,obstacles will not be easy for this sector.,"['obstacl', 'easi', 'sector']",set(),N
55,"To start, health care is an incredibly  diverse and complex sector, with a wide range of industries and institutions of  varying sizes, technological sophistication, and resources.","['start', 'health', 'care', 'incred', 'divers', 'complex', 'sector', 'wide', 'rang', 'industri', 'institut', 'vari', 'size', 'technolog', 'sophist', 'resourc']","{'industri', 'technolog'}",Y
56,"It is also a sector where  cybersecurity often becomes conflated with privacy or compliance, complicating  the discussion.","['also', 'sector', 'cybersecur', 'often', 'becom', 'conflat', 'privaci', 'complianc', 'complic', 'discuss']",{'cybersecur'},Y
57,"This, in turn, is exacerbated by the fact that a successful public- private partnership depends on collaboration and trust with HHS – an  understandable challenge given the many participants in the sector who are  regulated by various entities within the Department.","['turn', 'exacerb', 'fact', 'success', 'privat', 'partnership', 'depend', 'collabor', 'trust', 'hh', 'understand', 'challeng', 'given', 'mani', 'particip', 'sector', 'regul', 'variou', 'entiti', 'within', 'depart']",set(),N
58,"small, rural health care institution – where cybersecurity falls to one employee who  is also responsible for managing IT systems and fixing copiers, among other duties  – what value do I get for the cost of joining the ISAC or listening to guidance from  the sector coordinating council?","['small', 'rural', 'health', 'care', 'institut', 'cybersecur', 'fall', 'one', 'employe', 'also', 'respons', 'manag', 'system', 'fix', 'copier', 'among', 'duti', 'valu', 'get', 'cost', 'join', 'isac', 'listen', 'guidanc', 'sector', 'coordin', 'council']","{'manag', 'cybersecur'}",Y
59,"At present, it is hard to answer that question,  especially for those institutions already operating on negative margins.","['present', 'hard', 'answer', 'question', 'especi', 'institut', 'alreadi', 'oper', 'neg', 'margin']",set(),N
60,"patients, as well as health care institutions – is too great.","['patient', 'well', 'health', 'care', 'institut', 'great']",set(),N
61,"Cybersecurity incidents   These challenges, however, must be overcome.","['cybersecur', 'incid', 'challeng', 'howev', 'must', 'overcom']",{'cybersecur'},Y
62,The cost of failure – for   Gaining the acceptance and support necessary to overcome historical   These and other challenges are understandable and daunting.,"['cost', 'failur', 'gain', 'accept', 'support', 'necessari', 'overcom', 'histor', 'challeng', 'understand', 'daunt']",set(),N
63,"If I am a   can result in life or death situations if a medical device is hacked, or an attack shuts  down a hospital’s computer systems.","['result', 'life', 'death', 'situat', 'medic', 'devic', 'hack', 'attack', 'shut', 'hospit', 'comput', 'system']",{'devic'},Y
64,Cybersecurity is a collective responsibility  and that is why it is imperative that this sector find a way to come together to find  a sustainable path forward.,"['cybersecur', 'collect', 'respons', 'imper', 'sector', 'find', 'way', 'come', 'togeth', 'find', 'sustain', 'path', 'forward']",{'cybersecur'},Y
65,this sector and what is needed to bring unity and commitment from all participants.,"['sector', 'need', 'bring', 'uniti', 'commit', 'particip']",set(),N
66,"These are the folks working in the trenches and while the sector has shown signs of  progress, much work remains to be done.","['folk', 'work', 'trench', 'sector', 'shown', 'sign', 'progress', 'much', 'work', 'remain', 'done']",{'work'},Y
67,"I look forward to hearing more from our witnesses about the challenges of               Testimony of   Denise Anderson   On Behalf of the   The National Health Information Sharing & Analysis Center and the   National Council of Information Sharing and Analysis Centers   Before the   United States House of Representatives   Committee on Energy and Commerce   Subcommittee on Oversight and Investigations      April 4, 2017         Cybersecurity, Information Sharing and Partnership     NH-ISAC Testimony        ISAC BACKGROUND    April 4, 2017   Chairman Murphy and members of the Subcommittee, my name is Denise Anderson.","['look', 'forward', 'hear', 'wit', 'challeng', 'testimoni', 'denis', 'anderson', 'behalf', 'nation', 'health', 'inform', 'share', 'analysi', 'center', 'nation', 'council', 'inform', 'share', 'analysi', 'center', 'unit', 'state', 'hous', 'repres', 'committe', 'energi', 'commerc', 'subcommitte', 'oversight', 'investig', 'april', 'cybersecur', 'inform', 'share', 'partnership', 'testimoni', 'isac', 'background', 'april', 'chairman', 'murphi', 'member', 'subcommitte', 'name', 'denis', 'anderson']","{'inform', 'cybersecur'}",Y
68,I am   President of the National Health Information Sharing & Analysis Center (NH-ISAC) and Chair   of the National Council of ISACs (NCI).,"['presid', 'nation', 'health', 'inform', 'share', 'analysi', 'center', 'chair', 'nation', 'council', 'isac', 'nci']",{'inform'},Y
69,I want to thank you for this opportunity to address the   Oversight and Investigations Subcommittee about the industry perspective on cybersecurity and   information sharing as well as the importance of collaboration and coordination between the   public and private sectors.,"['want', 'thank', 'opportun', 'address', 'oversight', 'investig', 'subcommitte', 'industri', 'perspect', 'cybersecur', 'inform', 'share', 'well', 'import', 'collabor', 'coordin', 'public', 'privat', 'sector']","{'industri', 'inform', 'cybersecur'}",Y
70,"ISACs were formed in response to the 1998 Presidential Decision Directive 63 (PDD 63), which   called for the public and private sectors to work together to address cyber threats to the nation’s   critical infrastructures.","['isac', 'form', 'respons', 'presidenti', 'decis', 'direct', 'pdd', 'call', 'public', 'privat', 'sector', 'work', 'togeth', 'address', 'cyber', 'threat', 'nation', 'critic', 'infrastructur']","{'work', 'cyber'}",Y
71,"After 9/11, in response to Homeland Security Presidential Directive 7 (its   2013 successor, Presidential Policy Directive 21) and the Homeland Security Act, ISACs   expanded their role to encompass physical threats to their respective sectors.","['respons', 'homeland', 'secur', 'presidenti', 'direct', 'successor', 'presidenti', 'polici', 'direct', 'homeland', 'secur', 'act', 'isac', 'expand', 'role', 'encompass', 'physic', 'threat', 'respect', 'sector']",{'secur'},Y
72,Many ISACs have   been in existence over a decade and in some cases almost two decades.,"['mani', 'isac', 'exist', 'decad', 'case', 'almost', 'two', 'decad']",set(),N
73,"ISACs are primarily trusted communities that promote the sharing of timely, actionable and   reliable information for their respective critical infrastructure sectors and provide forums for   owner and operator sharing around threats, incidents, vulnerabilities, best practices and   mitigation strategies.","['isac', 'primarili', 'trust', 'commun', 'promot', 'share', 'time', 'action', 'reliabl', 'inform', 'respect', 'critic', 'infrastructur', 'sector', 'provid', 'forum', 'owner', 'oper', 'share', 'around', 'threat', 'incid', 'vulner', 'best', 'practic', 'mitig', 'strategi']","{'practic', 'inform'}",Y
74,ISACs are operational in nature and have strong reach into their sectors in   order to gather and disseminate information quickly and efficiently.,"['isac', 'oper', 'natur', 'strong', 'reach', 'sector', 'order', 'gather', 'dissemin', 'inform', 'quickli', 'effici']",{'inform'},Y
75,"ISACs have been thriving   and growing in recent years as owners and operators have seen the benefit to participating in   these trusted communities, which is a testament to the value ISACs deliver to their members.","['isac', 'thrive', 'grow', 'recent', 'year', 'owner', 'oper', 'seen', 'benefit', 'particip', 'trust', 'commun', 'testament', 'valu', 'isac', 'deliv', 'member']",set(),N
76,"National Council of ISACs and National Health Information Sharing & Analysis Center     Page 2   Cybersecurity, Information Sharing and Partnership     NH-ISAC Testimony        NCI BACKGROUND    April 4, 2017   The NCI is a voluntary organization of ISACs formed in 2003 in recognition of the need for the   ISACs to share information with each other about common threats and issues.","['nation', 'council', 'isac', 'nation', 'health', 'inform', 'share', 'analysi', 'center', 'page', 'cybersecur', 'inform', 'share', 'partnership', 'testimoni', 'nci', 'background', 'april', 'nci', 'voluntari', 'organ', 'isac', 'form', 'recognit', 'need', 'isac', 'share', 'inform', 'common', 'threat', 'issu']","{'organ', 'inform', 'cybersecur'}",Y
