No.,Sentence,StemWords,MatchWords,Use
969,These take the form of norma- tive statements or principles about simultaneously pursuing greater cyber security  and also upholding values of privacy and civil liberties (a tension that has been  of particular pertinence since the Edward Snowden case of 2013).,"['take', 'form', 'tive', 'statement', 'principl', 'simultan', 'pursu', 'greater', 'cyber', 'secur', 'also', 'uphold', 'valu', 'privaci', 'civil', 'liberti', 'tension', 'particular', 'pertin', 'sinc', 'edward', 'snowden', 'case']","{'secur', 'cyber'}",Y
970,"The 2003 US  National Strategy to Secure Cyberspace states that cyber security and personal  privacy need not be opposing goals and that the federal government should ‘lead  by example in implementing strong privacy policies and practices’.34 The 2009 UK  strategy is somewhat more forthright about the intention to exploit opportunities  for data gathering35 in balance with civil liberties and privacy, upon which ‘our  freedoms depend ... and which form the basis of our society’.36 The individual’s  cyber security, then, is important at a profound societal level—but may have to  be subsumed into broader collective state concerns.","['us', 'nation', 'strategi', 'secur', 'cyberspac', 'state', 'cyber', 'secur', 'person', 'privaci', 'need', 'oppos', 'goal', 'feder', 'govern', 'lead', 'exampl', 'implement', 'strong', 'privaci', 'polici', 'practic', 'uk', 'strategi', 'somewhat', 'forthright', 'intent', 'exploit', 'opportun', 'data', 'balanc', 'civil', 'liberti', 'privaci', 'upon', 'freedom', 'depend', 'form', 'basi', 'societi', 'individu', 'cyber', 'secur', 'import', 'profound', 'societ', 'may', 'subsum', 'broader', 'collect', 'state', 'concern']","{'practic', 'secur', 'implement', 'cyber'}",Y
971,The importance of the internet to national economies makes the business sector  a  key  focus  in  these  strategies.,"['import', 'internet', 'nation', 'economi', 'make', 'busi', 'sector', 'key', 'focu', 'strategi']",{'internet'},Y
972,"In  any  analysis  of  how  politicians  regard  cyber  security  as  a  problem  for  US  power,  economic  factors  feature  significantly.37  33  Peter Burgess, ed., The Routledge handbook of new security studies (London and New York: Routledge, 2010).","['analysi', 'politician', 'regard', 'cyber', 'secur', 'problem', 'us', 'power', 'econom', 'factor', 'featur', 'peter', 'burgess', 'routledg', 'handbook', 'new', 'secur', 'studi', 'london', 'new', 'york', 'routledg']","{'secur', 'cyber'}",Y
973,"34  Bush, National Strategy to Secure Cyberspace, pp.","['bush', 'nation', 'strategi', 'secur', 'cyberspac', 'pp']",{'secur'},Y
974,14–15.,[],set(),N
975,"35  Cyber Security Strategy of the United Kingdom, pp.","['cyber', 'secur', 'strategi', 'unit', 'kingdom', 'pp']","{'secur', 'cyber'}",Y
976,"4, 15.",[],set(),N
977,"36  Cyber Security Strategy of the United Kingdom, p. 10.","['cyber', 'secur', 'strategi', 'unit', 'kingdom']","{'secur', 'cyber'}",Y
978,"37  Senator Daniel Akaka referred to the internet as the ‘backbone of the US economy’ in a statement at ‘Securing  cyberspace: efforts to protect national information infrastructures continue to face challenges’, hearing before  the Committee on Homeland Security and Governmental Affairs, and the Subcommittee on Federal Finan-  50  Madeline CarrInternational Affairs 92: 1, 2016Copyright © 2016 The Author(s).","['senat', 'daniel', 'akaka', 'refer', 'internet', 'backbon', 'us', 'economi', 'statement', 'secur', 'cyberspac', 'effort', 'protect', 'nation', 'inform', 'infrastructur', 'continu', 'face', 'challeng', 'hear', 'committe', 'homeland', 'secur', 'government', 'affair', 'subcommitte', 'feder', 'madelin', 'carrintern', 'affair', 'author']","{'internet', 'secur', 'inform'}",Y
979,International Affairs © 2016 The Royal Institute of International Affairs.,"['intern', 'affair', 'royal', 'institut', 'intern', 'affair']",{'intern'},Y
980,"Indeed,  in  a  2009  speech  entitled  ‘Securing  our  nation’s  cyber  infrastructure’,  President Obama stated definitively that ‘America’s economic prosperity in the  21st century will depend on cybersecurity’.38 In the ‘landscape review’ of the UK  cyber-security strategy, Amyas Morse makes the point that if the internet were  a national economy, it would be the fifth largest in the world.39 In addition, he  writes, the UK has one of the world’s largest online economies, with 8 per cent  of GDP generated online—a higher proportion than for any other G20 country.40  To this end, the UK national Cyber Security Strategy specifically addresses the  financial cost to businesses of security breaches.41 Intellectual property is also a  key concern for the business sector; the US Cyberspace Policy Review quotes a  2008 estimate that set the value of losses due to data theft as high as $1 trillion.42 Protecting the state also means ensuring the integrity and smooth functioning  of  the  internet  itself  because  so  many  other  systems  rely  upon  it.","['inde', 'speech', 'entitl', 'secur', 'nation', 'cyber', 'infrastructur', 'presid', 'obama', 'state', 'definit', 'america', 'econom', 'prosper', 'centuri', 'depend', 'cybersecur', 'landscap', 'review', 'uk', 'strategi', 'amya', 'mors', 'make', 'point', 'internet', 'nation', 'economi', 'would', 'fifth', 'largest', 'addit', 'write', 'uk', 'one', 'world', 'largest', 'onlin', 'economi', 'per', 'cent', 'gdp', 'gener', 'higher', 'proport', 'end', 'uk', 'nation', 'cyber', 'secur', 'strategi', 'specif', 'address', 'financi', 'cost', 'busi', 'secur', 'intellectu', 'properti', 'also', 'key', 'concern', 'busi', 'sector', 'us', 'cyberspac', 'polici', 'review', 'quot', 'estim', 'set', 'valu', 'loss', 'due', 'data', 'theft', 'high', 'protect', 'state', 'also', 'mean', 'ensur', 'integr', 'smooth', 'function', 'internet', 'mani', 'system', 'reli', 'upon']","{'internet', 'secur', 'cyber', 'cybersecur'}",Y
981,"The  Obama  administration’s first National Security Strategy in 2010 elevated the internet to  the position of ‘strategic national asset’ and declared that protecting it was now a  ‘national security priority’.43 The UK Cyber Security Strategy states that it is the  ‘effective functioning of cyber space’ that is of vital importance.44 This introduces  some  conflation  of  ideas  about  cyber  security,  because  in  addition  to  being  an  object to be protected, the internet is also, of course, the source of threats (from  what?)","['obama', 'administr', 'first', 'nation', 'secur', 'strategi', 'elev', 'internet', 'posit', 'strateg', 'nation', 'asset', 'declar', 'protect', 'nation', 'secur', 'prioriti', 'uk', 'cyber', 'secur', 'strategi', 'state', 'effect', 'function', 'cyber', 'space', 'vital', 'introduc', 'conflat', 'idea', 'cyber', 'secur', 'addit', 'object', 'protect', 'internet', 'also', 'cours', 'sourc', 'threat']","{'internet', 'secur', 'cyber'}",Y
982,and the mechanism through which those threats can be addressed (by what  means?).,"['mechan', 'threat', 'address', 'mean']",set(),N
983,"However, it is clear in these strategies that the network itself is a primary  referent object for conceptions of security.","['howev', 'clear', 'strategi', 'network', 'primari', 'refer', 'object', 'concept', 'secur']","{'secur', 'network'}",Y
984,"It is the security of the technology itself,  as well as the security of those who use the technology, that concerns the US  and UK governments here; and the two forms of security are linked.","['secur', 'technolog', 'well', 'secur', 'use', 'technolog', 'concern', 'us', 'uk', 'govern', 'two', 'form', 'secur', 'link']","{'secur', 'technolog'}",Y
985,"‘Citizens,  business and government can enjoy the full benefits of a safe, secure and resilient  cyber space.’45 The technology becomes an artefact to be protected, an asset essen- tial to broader state security.","['citizen', 'busi', 'govern', 'enjoy', 'full', 'benefit', 'safe', 'secur', 'resili', 'cyber', 'technolog', 'becom', 'artefact', 'protect', 'asset', 'tial', 'broader', 'state', 'secur']","{'secur', 'cyber', 'technolog'}",Y
986,"There exists, then, a level of conceptual confusion within this question.","['exist', 'level', 'conceptu', 'confus', 'within', 'question']",set(),N
987,Who  is to be protected in these cyber-security strategies?,"['protect', 'strategi']",set(),N
988,"Is it individuals—and, if so,  what happens when the state itself is perceived as the threat to security, as it was  for some in the context of the Prism/Tempora programme?46 If businesses are to   cial Management, Government Information, and International Security, US Senate, 19 July 2005, p. 5.","['happen', 'state', 'perceiv', 'threat', 'secur', 'context', 'programm', 'busi', 'cial', 'manag', 'govern', 'inform', 'intern', 'secur', 'us', 'senat', 'juli']","{'secur', 'manag', 'inform', 'intern'}",Y
989,"In a  similar context, Representative Tom Davis called the internet the ‘central backbone of our global economy’  in his statement at ‘Computer security: cyber attacks: war without borders’, hearing before the Committee  on Government Reform, US House of Representatives, 26 July 2000, p. 6.","['similar', 'context', 'repres', 'tom', 'davi', 'call', 'internet', 'central', 'backbon', 'global', 'economi', 'statement', 'comput', 'secur', 'cyber', 'attack', 'war', 'without', 'border', 'hear', 'committe', 'govern', 'reform', 'us', 'hous', 'repres', 'juli']","{'internet', 'secur', 'cyber'}",Y
990,"38  Obama, ‘Remarks by the President on securing our nation’s cyber infrastructure’.","['obama', 'remark', 'presid', 'secur', 'nation', 'cyber', 'infrastructur']","{'secur', 'cyber'}",Y
991,"39  David Dean, Sebastian Digrande, Dominic Field, Andreas Lundmark, James O’Day, John Pineda and Paul  Zwillenberg, The Internet economy in the G-20: the $4.2 trillion growth opportunity (Boston Consulting Group,  March 2012), available online at http://www.bcg.com/documents/file100409.pdf , cited in Amyas Morse, The  UK Cyber Security Strategy: landscape review (London: House of Commons, 11 Feb. 2013), p. 5.","['david', 'dean', 'sebastian', 'digrand', 'domin', 'field', 'andrea', 'lundmark', 'jame', 'day', 'john', 'pineda', 'paul', 'zwillenberg', 'internet', 'economi', 'trillion', 'growth', 'opportun', 'boston', 'consult', 'group', 'march', 'avail', 'onlin', 'http', 'cite', 'amya', 'mors', 'uk', 'cyber', 'secur', 'strategi', 'landscap', 'review', 'london', 'hous', 'common']","{'internet', 'secur', 'group', 'cyber'}",Y
992,"40  Morse, The UK Cyber Security Strategy, p. 5.","['mors', 'uk', 'cyber', 'secur', 'strategi']","{'secur', 'cyber'}",Y
993,"41  Cyber Security Strategy of the United Kingdom, p. 12.","['cyber', 'secur', 'strategi', 'unit', 'kingdom']","{'secur', 'cyber'}",Y
994,"42  Melissa Hathaway, Cyberspace policy review: assuring a trusted and resilient information and communications infrastruc-  ture (Washington DC: The White House, May 2009), p. 2.","['melissa', 'hathaway', 'cyberspac', 'polici', 'review', 'assur', 'trust', 'resili', 'inform', 'commun', 'ture', 'washington', 'dc', 'white', 'hous', 'may']",{'inform'},Y
995,"43  Barack Obama, United States National Security Strategy (Washington DC: The White House, 2010), p. 27.","['barack', 'obama', 'unit', 'state', 'nation', 'secur', 'strategi', 'washington', 'dc', 'white', 'hous']",{'secur'},Y
996,"44  Cyber Security Strategy of the United Kingdom, p. 3.","['cyber', 'secur', 'strategi', 'unit', 'kingdom']","{'secur', 'cyber'}",Y
997,"45  Cyber Security Strategy of the United Kingdom, p. 3.","['cyber', 'secur', 'strategi', 'unit', 'kingdom']","{'secur', 'cyber'}",Y
998,46  The  Prism  programme  refers  to  the  US  National  Security  Agency’s  practice  of  collecting  personal  data  through a range of online services like social media and search engines.,"['prism', 'programm', 'refer', 'us', 'nation', 'secur', 'agenc', 'practic', 'collect', 'person', 'data', 'rang', 'onlin', 'servic', 'like', 'social', 'media', 'search', 'engin']","{'practic', 'secur'}",Y
999,"It was revealed by NSA contractor  51  Public–private partnerships in national cyber-security strategiesInternational Affairs 92: 1, 2016Copyright © 2016 The Author(s).","['reveal', 'nsa', 'contractor', 'partnership', 'nation', 'strategiesintern', 'affair', 'author']",set(),N
1000,International Affairs © 2016 The Royal Institute of International Affairs.,"['intern', 'affair', 'royal', 'institut', 'intern', 'affair']",{'intern'},Y
1001,"be protected, we might expect a greater contribution from that sector to finance  national cyber security.","['protect', 'might', 'expect', 'greater', 'contribut', 'sector', 'financ', 'nation', 'cyber', 'secur']","{'secur', 'cyber'}",Y
1002,Or is national cyber security to be regarded as a business  subsidy?,"['nation', 'cyber', 'secur', 'regard', 'busi', 'subsidi']","{'secur', 'cyber'}",Y
1003,"And finally, if the protection of the network is also the object of the  strategies,  it  becomes  clear  that  conflicts  and  tensions  between  these  goals  are  likely to become manifest in any arrangements to achieve them.","['final', 'protect', 'network', 'also', 'object', 'strategi', 'becom', 'clear', 'conflict', 'tension', 'goal', 'like', 'becom', 'manifest', 'arrang', 'achiev']",{'network'},Y
1004,Cyber security from what?,"['cyber', 'secur']","{'secur', 'cyber'}",Y
1005,"National cyber-security strategies tend to explicitly identify the actors from whom  threats  are  expected  to  emerge:  criminals,  terrorists  and  hostile  states.47  This  triumvirate of malicious actors is conceived as existing in a framework of offline  aggression and belligerence where it is possible to identify a perpetrator and, there- fore, their motivation.","['nation', 'strategi', 'tend', 'explicitli', 'identifi', 'actor', 'threat', 'expect', 'emerg', 'crimin', 'terrorist', 'hostil', 'triumvir', 'malici', 'actor', 'conceiv', 'exist', 'framework', 'offlin', 'aggress', 'belliger', 'possibl', 'identifi', 'perpetr', 'fore', 'motiv']",set(),N
1006,"Online, where it can be possible to conceal the origin of  attacks, these distinctions have less meaning; but they are so firmly entrenched in  our political and legal systems that it has proved difficult to conceptualize threats  in cyberspace beyond these terms.","['onlin', 'possibl', 'conceal', 'origin', 'attack', 'distinct', 'less', 'mean', 'firmli', 'entrench', 'polit', 'legal', 'system', 'prove', 'difficult', 'conceptu', 'threat', 'cyberspac', 'beyond', 'term']",set(),N
1007,"Beyond articulating some conception of the actors that pose a threat in cyber- space, there are two main areas of concern that dominate the US and UK national  cyber-security  strategies.","['beyond', 'articul', 'concept', 'actor', 'pose', 'threat', 'space', 'two', 'main', 'area', 'concern', 'domin', 'us', 'uk', 'nation', 'strategi']",set(),N
1008,"One  is  the  economy,  which  was  briefly  dealt  with  in  the previous section.","['one', 'economi', 'briefli', 'dealt', 'previou', 'section']",set(),N
1009,The second is critical infrastructure protection; and this is  also the primary focus of the public–private partnership.,"['second', 'critic', 'infrastructur', 'protect', 'also', 'primari', 'focu', 'partnership']",set(),N
1010,"Critical infrastructure is  defined in the US as ‘systems and assets, whether physical or virtual, so vital to  the nation that their incapacity or destruction would have a debilitating impact on  national security, national economic security, national public health or safety, or  any combination of those matters’.48 The protection of critical infrastructure has  been linked to cyber security for the past 25 years, during which many advanced  industrialized states have privatized critical infrastructure systems such as water  and sewerage, electricity, finance, communications and transport.49 By the time  the new millennium arrived, some 85 per cent of US critical infrastructure was  in private hands.50 With privatization came an increased discretion on the part  of those managing the infrastructure in the choice of systems and technology to  control these utilities and industries, and many of them moved from proprietary   Edward Snowden in June 2013.","['critic', 'infrastructur', 'defin', 'us', 'system', 'asset', 'whether', 'physic', 'virtual', 'vital', 'nation', 'incapac', 'destruct', 'would', 'debilit', 'impact', 'nation', 'secur', 'nation', 'econom', 'secur', 'nation', 'public', 'health', 'safeti', 'combin', 'matter', 'protect', 'critic', 'infrastructur', 'link', 'cyber', 'secur', 'past', 'year', 'mani', 'advanc', 'industri', 'state', 'privat', 'critic', 'infrastructur', 'system', 'water', 'sewerag', 'electr', 'financ', 'commun', 'time', 'new', 'millennium', 'arriv', 'per', 'cent', 'us', 'critic', 'infrastructur', 'privat', 'privat', 'came', 'increas', 'discret', 'part', 'manag', 'infrastructur', 'choic', 'system', 'technolog', 'control', 'util', 'industri', 'mani', 'move', 'proprietari', 'edward', 'snowden', 'june']","{'industri', 'control', 'technolog', 'manag', 'cyber', 'secur'}",Y
1011,"He also revealed details about the UK Government Communications Head- quarters (GCHQ) Tempora program which gathered data through intercepts placed on fibre-optic cables:  Luke Harding, The Snowden files: the inside story of the world’s most wanted man (London: Guardian Faber, 2014).","['also', 'reveal', 'detail', 'uk', 'govern', 'commun', 'quarter', 'gchq', 'tempora', 'program', 'gather', 'data', 'intercept', 'place', 'cabl', 'luke', 'hard', 'snowden', 'file', 'insid', 'stori', 'world', 'want', 'man', 'london', 'guardian', 'faber']",set(),N
1012,"47  Cyber Security Strategy of the United Kingdom, pp.","['cyber', 'secur', 'strategi', 'unit', 'kingdom', 'pp']","{'secur', 'cyber'}",Y
1013,"12–14; Hathaway, Cyberspace policy review, p. 1.","['hathaway', 'cyberspac', 'polici', 'review']",set(),N
1014,"48  Gregory C. Wilshusen, ‘Cyber security: continued attention needed to protect our nation’s critical infra- structure and federal information systems’, testimony before the Subcommittee on Cybersecurity, Infrastruc- ture Protection, and Security Technologies, Committee on Homeland Security, House of Representatives  (Washington DC: US Government Accountability Office, 16 March 2011), p. 2.","['gregori', 'wilshusen', 'cyber', 'secur', 'continu', 'attent', 'need', 'protect', 'nation', 'critic', 'structur', 'feder', 'inform', 'system', 'testimoni', 'subcommitte', 'cybersecur', 'ture', 'protect', 'secur', 'technolog', 'committe', 'homeland', 'secur', 'hous', 'repres', 'washington', 'dc', 'us', 'govern', 'account', 'offic', 'march']","{'inform', 'technolog', 'cyber', 'secur', 'cybersecur'}",Y
1015,"A similar definition is used in  the UK: ‘Those infrastructure assets ... that are vital to the continued delivery and integrity of the essential  services upon which the UK relies, the loss or compromise of which would lead to severe economic or social  consequences or to loss of life’.","['similar', 'definit', 'use', 'uk', 'infrastructur', 'asset', 'vital', 'continu', 'deliveri', 'integr', 'essenti', 'servic', 'upon', 'uk', 'reli', 'loss', 'compromis', 'would', 'lead', 'sever', 'econom', 'social', 'consequ', 'loss', 'life']",set(),N
1016,"See Centre for the Protection of National Infrastructure, ‘About CPNI: the  national infrastructure’, http://www.cpni.gov.uk/about/cni/, accessed 4 Nov. 2015.","['see', 'centr', 'protect', 'nation', 'infrastructur', 'cpni', 'nation', 'infrastructur', 'http', 'access']",{'access'},Y
1017,"49  Information Sharing Environment, ‘ISE’s participation in the Open Government initiative’, http://www.ise.","['inform', 'share', 'environ', 'ise', 'particip', 'open', 'govern', 'initi', 'http']",{'inform'},Y
1018,"gov/open, accessed 4 Nov. 2015.",['access'],{'access'},Y
1019,"50  ‘Agency  response  to  cyberspace  policy  review’,  presented  to  the  Committee  on  Science  and  Technology,  Subcommittee on Technology and Innovation and Subcommittee on Research and Science Education, US  House of Representatives, 16 June 2009, p. 3.","['agenc', 'respons', 'cyberspac', 'polici', 'review', 'present', 'committe', 'scienc', 'technolog', 'subcommitte', 'technolog', 'innov', 'subcommitte', 'research', 'scienc', 'educ', 'us', 'hous', 'repres', 'june']",{'technolog'},Y
1020,"52  Madeline CarrInternational Affairs 92: 1, 2016Copyright © 2016 The Author(s).","['madelin', 'carrintern', 'affair', 'author']",set(),N
1021,International Affairs © 2016 The Royal Institute of International Affairs.,"['intern', 'affair', 'royal', 'institut', 'intern', 'affair']",{'intern'},Y
1022,systems to more generic computer programs known as ‘supervisory control and  data acquisition systems’ (SCADA systems).,"['system', 'gener', 'comput', 'program', 'known', 'supervisori', 'control', 'data', 'acquisit', 'system', 'scada', 'system']",{'control'},Y
1023,"While SCADA systems boosted the  productivity and efficiency of many industries and services by allowing critical  infrastructure to be controlled centrally and remotely, the combination of private  ownership  and  the  vulnerabilities  of  SCADA  systems  led  to  a  range  of  cyber- security  concerns  around  critical  infrastructure  protection  when  these  systems  began to be connected to the internet.","['scada', 'system', 'boost', 'product', 'effici', 'mani', 'industri', 'servic', 'allow', 'critic', 'infrastructur', 'control', 'central', 'remot', 'combin', 'privat', 'ownership', 'vulner', 'scada', 'system', 'led', 'rang', 'secur', 'concern', 'around', 'critic', 'infrastructur', 'protect', 'system', 'began', 'connect', 'internet']","{'secur', 'industri', 'control', 'internet'}",Y
1024,An  attack  on  critical  infrastructure  remains  one  of  the  dominant  themes  of  debates about cyber insecurity in the US.,"['attack', 'critic', 'infrastructur', 'remain', 'one', 'domin', 'theme', 'debat', 'cyber', 'insecur', 'us']",{'cyber'},Y
1025,"In a congressional hearing on SCADA  vulnerabilities, Representative Bill Pascrell stated: ‘We know that vulnerabilities  within these systems are abundant, and we know that the threat of a terrorist attack  against these systems is real.’51 Over the course of the past decade, this type of  attack has emerged not only as a terrorist threat but also in the context of state-to- state conflict, as was demonstrated in Estonia in 2007 and Georgia in 2008 and, of  course, in the Stuxnet episode of 2010.","['congression', 'hear', 'scada', 'vulner', 'repres', 'bill', 'pascrel', 'state', 'know', 'vulner', 'within', 'system', 'abund', 'know', 'threat', 'terrorist', 'attack', 'system', 'cours', 'past', 'decad', 'type', 'attack', 'emerg', 'terrorist', 'threat', 'also', 'context', 'state', 'conflict', 'demonstr', 'estonia', 'georgia', 'cours', 'stuxnet', 'episod']",set(),N
1026,"Critical infrastructure is typically discussed  in terms of ‘sectors’, and these come under the purview of government agencies  or departments.52 For the most part, the trend has been towards industry self- regulation, best practices and some coordination in terms of information-sharing  with the government.","['critic', 'infrastructur', 'typic', 'discuss', 'term', 'sector', 'come', 'purview', 'govern', 'agenc', 'part', 'trend', 'toward', 'industri', 'regul', 'best', 'practic', 'coordin', 'term', 'govern']","{'practic', 'industri'}",Y
1027,"This is central to the public–private partnership, which is  in large part ‘the means’.","['central', 'partnership', 'larg', 'part', 'mean']",set(),N
1028,Cyber security by what means?,"['cyber', 'secur', 'mean']","{'secur', 'cyber'}",Y
1029,It is not necessary in this article to describe in detail every policy proposal and  recommendation  in  the  strategy  documents.,"['necessari', 'articl', 'describ', 'detail', 'everi', 'polici', 'propos', 'recommend', 'strategi', 'document']",set(),N
1030,"What  is  of  interest  to  the  core  research objectives here is that two dominant lines of practice emerge in response  to the question: ‘By what means?’ First, as discussed briefly above, there is a persis- tent emphasis on remaining anchored in core values and norms that are believed to  underpin the national identity and power more broadly—what Hans Morgenthau  referred to as the ‘national character’.53 In the 2010 US National Security Strategy,  President Obama argued that: ‘Fidelity to our values is the reason why the United  States of America grew from a small string of colonies under the writ of an empire   51  Representative Bill Pascrell, prepared statement at ‘SCADA systems and the terrorist threat: protecting the  nation’s critical control systems’, joint hearing before the Subcommittee on Economic Security, Infrastructure  Protection, and Cybersecurity with the Subcommittee on Emergency Preparedness, Science, and Technology  of the Committee of Homeland Security on 18 Oct. 2005, p. 3.","['interest', 'core', 'research', 'object', 'two', 'domin', 'line', 'practic', 'emerg', 'respons', 'question', 'mean', 'first', 'discuss', 'briefli', 'tent', 'emphasi', 'remain', 'anchor', 'core', 'valu', 'norm', 'believ', 'underpin', 'nation', 'ident', 'power', 'han', 'morgenthau', 'refer', 'nation', 'charact', 'us', 'nation', 'secur', 'strategi', 'presid', 'obama', 'argu', 'fidel', 'valu', 'reason', 'unit', 'state', 'america', 'grew', 'small', 'string', 'coloni', 'writ', 'empir', 'repres', 'bill', 'pascrel', 'prepar', 'statement', 'scada', 'system', 'terrorist', 'threat', 'protect', 'nation', 'critic', 'control', 'system', 'joint', 'hear', 'subcommitte', 'econom', 'secur', 'infrastructur', 'protect', 'cybersecur', 'subcommitte', 'emerg', 'prepared', 'scienc', 'technolog', 'committe', 'homeland', 'secur']","{'control', 'technolog', 'practic', 'secur', 'cybersecur'}",Y
