No.,Sentence,StemWords,MatchWords,Use
268,"While these advances offer tremendous potential healthcare benefits and   Page 4               Cybersecurity in the Healthcare Sector: Strengthening Public-Private Partnerships          may help to reduce cost across the industry, we are rapidly increasing the cyber attack   surface in the healthcare sector.","['advanc', 'offer', 'tremend', 'potenti', 'healthcar', 'benefit', 'page', 'cybersecur', 'healthcar', 'sector', 'strengthen', 'partnership', 'may', 'help', 'reduc', 'cost', 'across', 'industri', 'rapidli', 'increas', 'cyber', 'attack', 'surfac', 'healthcar', 'sector']","{'industri', 'cyber', 'cybersecur'}",Y
269,The risk is exacerbated by the fact that software   developers have not yet come up with a way to prevent errors and mistakes in the   software they create.,"['risk', 'exacerb', 'fact', 'softwar', 'develop', 'yet', 'come', 'way', 'prevent', 'error', 'mistak', 'softwar', 'creat']",{'develop'},Y
270,"In fact, computer programmers continue to make many of the same   mistakes in their code that were made 15-20 years ago.","['fact', 'comput', 'programm', 'continu', 'make', 'mani', 'mistak', 'code', 'made', 'year', 'ago']",set(),N
271,Today we measure software   errors in the number of defects per thousand lines of code; many of medical applications   being developed contain millions if not tens of millions of lines of software code.,"['today', 'measur', 'softwar', 'error', 'number', 'defect', 'per', 'thousand', 'line', 'code', 'mani', 'medic', 'applic', 'develop', 'contain', 'million', 'ten', 'million', 'line', 'softwar', 'code']","{'measur', 'develop'}",Y
272,We   will be dealing with these inadvertent flaws for a decade or more from now.,"['deal', 'inadvert', 'flaw', 'decad']",set(),N
273,So we must   account for this with additional preventative and detective controls.,"['must', 'account', 'addit', 'prevent', 'detect', 'control']",{'control'},Y
274,5.,[],set(),N
275,Anecdotal electronic evidence also suggests there are a lot more security incidents than   what is currently reported.,"['anecdot', 'electron', 'evid', 'also', 'suggest', 'lot', 'secur', 'incid', 'current', 'report']",{'secur'},Y
276,"As part of normal information security monitoring, it is quite   common to find information about other companies that have been attacked or even   compromised.","['part', 'normal', 'inform', 'secur', 'monitor', 'quit', 'common', 'find', 'inform', 'compani', 'attack', 'even', 'compromis']","{'secur', 'inform'}",Y
277,These indicators might be something as simple as malware traffic   emanating from a partner’s network or the observation of another company’s name   showing up in a data dump released by an attacker.,"['indic', 'might', 'someth', 'simpl', 'malwar', 'traffic', 'eman', 'partner', 'network', 'observ', 'anoth', 'compani', 'name', 'show', 'data', 'dump', 'releas', 'attack']",{'network'},Y
278,"In fact, there are web services like   Shodan that specialize in identifying and cataloging vulnerable systems and devices   including many from the healthcare industry in an easily searchable web interface.","['fact', 'web', 'servic', 'like', 'shodan', 'special', 'identifi', 'catalog', 'vulner', 'system', 'devic', 'includ', 'mani', 'healthcar', 'industri', 'easili', 'searchabl', 'web', 'interfac']","{'industri', 'includ', 'devic'}",Y
279,"When all of these observations are combined, it leads me, and many of my peers, to believe   that the cybersecurity situation in the healthcare industry is far worse than what public reporting   indicates.","['observ', 'combin', 'lead', 'mani', 'peer', 'believ', 'cybersecur', 'situat', 'healthcar', 'industri', 'far', 'wors', 'public', 'report', 'indic']","{'industri', 'cybersecur'}",Y
280,Neither private industry nor the government can solve this problem alone; we must   work collaboratively and transparently to reduce this risk.,"['neither', 'privat', 'industri', 'govern', 'solv', 'problem', 'alon', 'must', 'work', 'collabor', 'transpar', 'reduc', 'risk']","{'industri', 'work'}",Y
281,Page 5   Cybersecurity in the Healthcare Sector: Strengthening Public-Private Partnerships         THE VALUE OF PUBLIC-PRIVATE PARTNERSHIPS IN CYBERSECURITY   The notion of public – private partnerships for cybersecurity first gained traction in 1997   following the publication of recommendations from the President’s Commission on Critical   Infrastructure Protection.,"['page', 'cybersecur', 'healthcar', 'sector', 'strengthen', 'partnership', 'valu', 'partnership', 'cybersecur', 'notion', 'public', 'privat', 'partnership', 'cybersecur', 'first', 'gain', 'traction', 'follow', 'public', 'recommend', 'presid', 'commiss', 'critic', 'infrastructur', 'protect']",{'cybersecur'},Y
282,"These recommendations were codified in Presidential Decision   Directive/NSC 63- Critical Infrastructure Protection which specified the industry segments that   should be considered critical infrastructure, appointed a sector specific agency to coordinate the   public-private partnership, and identified ten tasks that should be accomplished by each sector.","['recommend', 'codifi', 'presidenti', 'decis', 'critic', 'infrastructur', 'protect', 'specifi', 'industri', 'segment', 'consid', 'critic', 'infrastructur', 'appoint', 'sector', 'specif', 'agenc', 'coordin', 'partnership', 'identifi', 'ten', 'task', 'accomplish', 'sector']",{'industri'},Y
283,A Government Coordinating Council and Sector Coordinating Council were created to represent   the myriad of government departments/agencies and private sector participants respectively.,"['govern', 'coordin', 'council', 'sector', 'coordin', 'council', 'creat', 'repres', 'myriad', 'govern', 'privat', 'sector', 'particip', 'respect']",set(),N
284,"The   tasks included an assessment of threats and vulnerabilities that might impact the sector, the   development of a sector-wide remediation/protection plan, and the sharing of intelligence   information between the government and private sector.","['task', 'includ', 'assess', 'threat', 'vulner', 'might', 'impact', 'sector', 'develop', 'plan', 'share', 'intellig', 'inform', 'govern', 'privat', 'sector']","{'inform', 'develop', 'includ'}",Y
285,"Although subsequent administrations   have tweaked the industries and functions that make up the critical infrastructure and have made   minor modifications to the tasks on which each sector should focus, by and large there has been   support for the concept for two decades.","['although', 'subsequ', 'administr', 'tweak', 'industri', 'function', 'make', 'critic', 'infrastructur', 'made', 'minor', 'modif', 'task', 'sector', 'focu', 'larg', 'support', 'concept', 'two', 'decad']",{'industri'},Y
286,The healthcare and public health sector has been designated a part of the critical   infrastructure since PDD-63.,"['healthcar', 'public', 'health', 'sector', 'design', 'part', 'critic', 'infrastructur', 'sinc']",set(),N
287,The Department of Health and Human Services (HHS) has been   the sector specific agency since that time.,"['depart', 'health', 'human', 'servic', 'hh', 'sector', 'specif', 'agenc', 'sinc', 'time']",set(),N
288,"However, it is only in recent years that the topic of   cybersecurity has become a prominent issue.","['howev', 'recent', 'year', 'topic', 'cybersecur', 'becom', 'promin', 'issu']",{'cybersecur'},Y
289,The Sector Coordinating Council now devotes a   regular portion of its meetings and monthly teleconferences to discussing developments in the   cybersecurity space and has established working groups to tackle items of common interest   among the members.,"['sector', 'coordin', 'council', 'devot', 'regular', 'portion', 'meet', 'monthli', 'teleconfer', 'discuss', 'develop', 'cybersecur', 'space', 'establish', 'work', 'group', 'tackl', 'item', 'common', 'interest', 'among', 'member']","{'group', 'work', 'develop', 'cybersecur'}",Y
290,"The NH-ISAC, created in 2010, has grown from about a dozen original   members to more than 200 participating companies and it continues to attract more and more of        Page 6   Cybersecurity in the Healthcare Sector: Strengthening Public-Private Partnerships         the thousands of healthcare entities that exist in the United States.","['creat', 'grown', 'dozen', 'origin', 'member', 'particip', 'compani', 'continu', 'attract', 'page', 'cybersecur', 'healthcar', 'sector', 'strengthen', 'partnership', 'thousand', 'healthcar', 'entiti', 'exist', 'unit', 'state']",{'cybersecur'},Y
291,More importantly the quantity   and quality of actionable intelligence shared by members has increased substantially in the last   12-18 months.,"['importantli', 'quantiti', 'qualiti', 'action', 'intellig', 'share', 'member', 'increas', 'substanti', 'last', 'month']",set(),N
292,"The NH-ISAC has stood up working groups that work collaboratively to identify   new sources of threat intelligence and ways to disseminate to all parties in the most effective   manner, and to collaborate on ways to more effectively secure “big data” within the healthcare   industry, but both organizations have the potential to do even more.","['stood', 'work', 'group', 'work', 'collabor', 'identifi', 'new', 'sourc', 'threat', 'intellig', 'way', 'dissemin', 'parti', 'effect', 'manner', 'collabor', 'way', 'effect', 'secur', 'big', 'data', 'within', 'healthcar', 'industri', 'organ', 'potenti', 'even']","{'industri', 'work', 'group', 'secur', 'organ'}",Y
293,"At the same time, other public-private partnerships have grown out of a desire to reduce   the cost and complexity of business.","['time', 'partnership', 'grown', 'desir', 'reduc', 'cost', 'complex', 'busi']",set(),N
294,The SAFE BioPharma Association was founded more than   a decade ago out of a shared desire between the government and private industry to reduce the   cost and complexity of submitting new drug applications to the Food and Drug Administration   (FDA).,"['safe', 'biopharma', 'associ', 'found', 'decad', 'ago', 'share', 'desir', 'govern', 'privat', 'industri', 'reduc', 'cost', 'complex', 'submit', 'new', 'drug', 'applic', 'food', 'drug', 'administr', 'fda']",{'industri'},Y
295,"In order to move away from paper-based submissions, all parties needed to agree on a   mechanism that would ensure data integrity, provide for non-repudiation, and ensure trust in the   identity of the signer.","['order', 'move', 'away', 'submiss', 'parti', 'need', 'agre', 'mechan', 'would', 'ensur', 'data', 'integr', 'provid', 'ensur', 'trust', 'ident', 'signer']",set(),N
296,"The members of SAFE BioPharma worked closely with the FDA, the   National Institute for Standards and Technology (NIST), the General Services Administration   (GSA), and regulators in the European Union and Japan to create a digital identity and digital   signature standard that today is accepted by all parties.","['member', 'safe', 'biopharma', 'work', 'close', 'fda', 'nation', 'institut', 'standard', 'technolog', 'nist', 'gener', 'servic', 'administr', 'gsa', 'regul', 'european', 'union', 'japan', 'creat', 'digit', 'ident', 'digit', 'signatur', 'standard', 'today', 'accept', 'parti']","{'work', 'technolog', 'standard'}",Y
297,The standard creates an interoperable   digital identity ecosystem in which all identities can be trusted at known risk-levels.,"['standard', 'creat', 'interoper', 'digit', 'ident', 'ecosystem', 'ident', 'trust', 'known']",{'standard'},Y
298,It allows   government agencies and private sector healthcare providers to have standardized trust for   authentication and signing.,"['allow', 'govern', 'agenc', 'privat', 'sector', 'healthcar', 'provid', 'standard', 'trust', 'authent', 'sign']",{'standard'},Y
299,Vendors have a tool for standardizing trust in their products and   applications and the user can have a single identity for use across the ecosystem.,"['vendor', 'tool', 'standard', 'trust', 'product', 'applic', 'user', 'singl', 'ident', 'use', 'across', 'ecosystem']",{'standard'},Y
300,"The standard   has been certified to meet US government federal identity standardsvii and is used on electronic   submissions, contracts, and other critical workflows that require integrity, identity trust, and non-  repudiation around the world.","['standard', 'certifi', 'meet', 'us', 'govern', 'feder', 'ident', 'standardsvii', 'use', 'electron', 'submiss', 'contract', 'critic', 'workflow', 'requir', 'integr', 'ident', 'trust', 'repudi', 'around', 'world']","{'requir', 'standard'}",Y
301,"More importantly, the industry has recently started adopting this        Page 7   Cybersecurity in the Healthcare Sector: Strengthening Public-Private Partnerships         digital identity standard for authentication purposes, much in the manner the US Federal   Government rapidly adopted the use of Personal Identity Verification (PIV) cards for strong   authentication following the Office of Personal Management (OPM) breach.","['importantli', 'industri', 'recent', 'start', 'adopt', 'page', 'cybersecur', 'healthcar', 'sector', 'strengthen', 'partnership', 'digit', 'ident', 'standard', 'authent', 'purpos', 'much', 'manner', 'us', 'feder', 'govern', 'rapidli', 'adopt', 'use', 'person', 'ident', 'verif', 'piv', 'card', 'strong', 'authent', 'follow', 'offic', 'person', 'manag', 'opm', 'breach']","{'industri', 'manag', 'cybersecur', 'standard'}",Y
302,"According to   Verizon’s 2016 Healthcare Data Breach Reportviii, two out of every three healthcare data   breaches have been caused by hijacked user names and passwords.","['accord', 'verizon', 'healthcar', 'data', 'breach', 'reportviii', 'two', 'everi', 'three', 'healthcar', 'data', 'breach', 'caus', 'hijack', 'user', 'name', 'password']",set(),N
303,SAFE BioPharma members   hope to increase the use of standards-based authentication credentials across the healthcare   industry.,"['safe', 'biopharma', 'member', 'hope', 'increas', 'use', 'authent', 'credenti', 'across', 'healthcar', 'industri']",{'industri'},Y
304,Particular emphasis is being placed on multi-factor authentication capabilities across   the healthcare industry using the SAFE BioPharma standard and other recognized standards that   meet the same level of security – all based on NIST and GSA standards.,"['particular', 'emphasi', 'place', 'authent', 'capabl', 'across', 'healthcar', 'industri', 'use', 'safe', 'biopharma', 'standard', 'recogn', 'standard', 'meet', 'level', 'secur', 'base', 'nist', 'gsa', 'standard']","{'secur', 'industri', 'standard'}",Y
305,"As a participant and user of services provided by all three public-private partnerships, I   feel each provides tremendous value and has become an essential part of my organization’s   cybersecurity program.","['particip', 'user', 'servic', 'provid', 'three', 'partnership', 'feel', 'provid', 'tremend', 'valu', 'becom', 'essenti', 'part', 'organ', 'cybersecur', 'program']","{'organ', 'cybersecur'}",Y
306,"We leverage the intelligence provided by the NH-ISAC to update our   defenses on a continuous, 24x7 basis, we use the NH-ISAC’s benchmarking service to identify   areas in where we may learn from our peers, we leverage SAFE BioPharma compliant digital   identities in collaborating with peer organizations, and we actively participated in the recent   DHS Cyberstorm table top exercise.","['leverag', 'intellig', 'provid', 'updat', 'defens', 'continu', 'basi', 'use', 'benchmark', 'servic', 'identifi', 'area', 'may', 'learn', 'peer', 'leverag', 'safe', 'biopharma', 'compliant', 'digit', 'ident', 'collabor', 'peer', 'organ', 'activ', 'particip', 'recent', 'dh', 'cyberstorm', 'tabl', 'top', 'exercis']",{'organ'},Y
307,But there are many opportunities to further mature and   develop these capabilities.,"['mani', 'opportun', 'matur', 'develop', 'capabl']",{'develop'},Y
308,OPPORTUNITIES FOR FURTHER PARTNERSHIP AND COLLABORATION   1.,"['opportun', 'partnership', 'collabor']",set(),N
309,Appoint a Healthcare Sector Cybersecurity Liaison.,"['appoint', 'healthcar', 'sector', 'cybersecur', 'liaison']",{'cybersecur'},Y
310,HHS should appoint a senior   cybersecurity professional as a liaison to the private sector.,"['hh', 'appoint', 'senior', 'cybersecur', 'profession', 'liaison', 'privat', 'sector']",{'cybersecur'},Y
311,Today the Assistant Secretary   for Preparedness and Response (ASPR) has the responsibility for ensuring the healthcare   sector is prepared to respond to a critical health emergency such as a pandemic flu outbreak   or the disruption of critical health infrastructure from a natural disaster as occurred in New        Page 8   Cybersecurity in the Healthcare Sector: Strengthening Public-Private Partnerships          Orleans during Hurricane Katrina.,"['today', 'assist', 'secretari', 'prepared', 'respons', 'aspr', 'respons', 'ensur', 'healthcar', 'sector', 'prepar', 'respond', 'critic', 'health', 'emerg', 'pandem', 'flu', 'outbreak', 'disrupt', 'critic', 'health', 'infrastructur', 'natur', 'disast', 'occur', 'new', 'page', 'cybersecur', 'healthcar', 'sector', 'strengthen', 'partnership', 'orlean', 'hurrican', 'katrina']",{'cybersecur'},Y
312,"The Office of National Coordinator (ONC) has a Chief   Privacy Officer who, along with the HHS Office of Civil Rights (OCR), works with the   private sector on privacy policies and implements enforcement actions when necessary.","['offic', 'nation', 'coordin', 'onc', 'chief', 'privaci', 'offic', 'along', 'hh', 'offic', 'civil', 'right', 'ocr', 'work', 'privat', 'sector', 'privaci', 'polici', 'implement', 'enforc', 'action', 'necessari']","{'work', 'implement'}",Y
313,HHS also has a Chief Information Security Officer (CISO) within the Office of the Chief   Information Officer (CIO) who is primarily responsible for protection of HHS systems and   services.,"['hh', 'also', 'chief', 'inform', 'secur', 'offic', 'ciso', 'within', 'offic', 'chief', 'inform', 'offic', 'cio', 'primarili', 'respons', 'protect', 'hh', 'system', 'servic']","{'secur', 'inform'}",Y
314,All four of these offices interact with the private sector but none of them have   cybersecurity outreach as their primary mission.,"['four', 'offic', 'interact', 'privat', 'sector', 'none', 'cybersecur', 'outreach', 'primari', 'mission']",{'cybersecur'},Y
315,A cybersecurity liaison would be the   primary focal point for outreach to the private industry on topics of cybersecurity.,"['cybersecur', 'liaison', 'would', 'primari', 'focal', 'point', 'outreach', 'privat', 'industri', 'topic', 'cybersecur']","{'industri', 'cybersecur'}",Y
316,"The role   would not supplant current responsibilities, but instead focus on education and awareness of   cybersecurity risks within the sector, advocacy for the use of cybersecurity tools and   capabilities provided by the Department of Homeland Security (DHS), and collection of key   issues from the sector.","['role', 'would', 'supplant', 'current', 'respons', 'instead', 'focu', 'educ', 'awar', 'cybersecur', 'risk', 'within', 'sector', 'advocaci', 'use', 'cybersecur', 'tool', 'capabl', 'provid', 'depart', 'homeland', 'secur', 'dh', 'collect', 'key', 'issu', 'sector']","{'secur', 'cybersecur'}",Y
317,The liaison would also chair a GCC working group on cybersecurity   that would work closely with the Sector Coordinating Council equivalent.,"['liaison', 'would', 'also', 'chair', 'gcc', 'work', 'group', 'cybersecur', 'would', 'work', 'close', 'sector', 'coordin', 'council', 'equival']","{'work', 'group', 'cybersecur'}",Y
318,2.,[],set(),N
319,Develop Cybersecurity Appendix to Healthcare & Public Sector Specific Plan.,"['develop', 'cybersecur', 'appendix', 'healthcar', 'public', 'sector', 'specif', 'plan']","{'develop', 'cybersecur'}",Y
320,"While   cybersecurity concerns were captured in the latest iteration of the Healthcare and Public   Health Sector Specific Plan - May 2016ix, a more thorough and detailed appendix should be   added to the existing plan to better assist public and private sector entities in developing their   own cybersecurity incident response plans.","['cybersecur', 'concern', 'captur', 'latest', 'iter', 'healthcar', 'public', 'health', 'sector', 'specif', 'plan', 'may', 'thorough', 'detail', 'appendix', 'ad', 'exist', 'plan', 'better', 'assist', 'public', 'privat', 'sector', 'entiti', 'develop', 'cybersecur', 'incid', 'respons', 'plan']","{'develop', 'cybersecur'}",Y
321,This appendix should include templates and   guidelines to help smaller and less mature organizations create at least a rudimentary   cybersecurity response plan.,"['appendix', 'includ', 'templat', 'guidelin', 'help', 'smaller', 'less', 'matur', 'organ', 'creat', 'least', 'rudimentari', 'cybersecur', 'respons', 'plan']","{'organ', 'includ', 'cybersecur'}",Y
322,3.,[],set(),N
323,Increase the Quality of Cybersecurity Intelligence and the Speed with Which It is   Shared.,"['increas', 'qualiti', 'cybersecur', 'intellig', 'speed', 'share']",{'cybersecur'},Y
324,"While there has been a significant increase in the quantity and timeliness of   information shared by government agencies via DHS over the last 24 months, there is still        Page 9   Cybersecurity in the Healthcare Sector: Strengthening Public-Private Partnerships          opportunity to improve both the quality of information and speed at which it is shared.","['signific', 'increas', 'quantiti', 'timeli', 'inform', 'share', 'govern', 'agenc', 'via', 'dh', 'last', 'month', 'still', 'page', 'cybersecur', 'healthcar', 'sector', 'strengthen', 'partnership', 'opportun', 'improv', 'qualiti', 'inform', 'speed', 'share']","{'inform', 'cybersecur'}",Y
325,"Cybersecurity defenders need to respond to threats in minutes, if not seconds.","['cybersecur', 'defend', 'need', 'respond', 'threat', 'minut', 'second']",{'cybersecur'},Y
326,Waiting days   or even weeks for information to be shared diminishes the value of the information.,"['wait', 'day', 'even', 'week', 'inform', 'share', 'diminish', 'valu', 'inform']",{'inform'},Y
327,"For   example, if an entity discovers a sophisticated phishing email that has been able to bypass an   organization’s email filters, it is critical that information on the subject line, sender’s address,   and other data about the message be sent out to others as quickly as possible so that the other   security teams can search for and delete these messages before their users fall victim to an   attack.","['exampl', 'entiti', 'discov', 'sophist', 'phish', 'email', 'abl', 'bypass', 'organ', 'email', 'filter', 'critic', 'inform', 'subject', 'line', 'sender', 'address', 'data', 'messag', 'sent', 'other', 'quickli', 'possibl', 'secur', 'team', 'search', 'delet', 'messag', 'user', 'fall', 'victim', 'attack']","{'secur', 'organ', 'inform'}",Y
328,"Today, members of the NH-ISAC are sharing this type of information in near real-   time.","['today', 'member', 'share', 'type', 'inform', 'near', 'time']",{'inform'},Y
329,We still need to increase the percentage of members willing to share but we also need   the government to share healthcare related cyber intelligence at similar speeds.,"['still', 'need', 'increas', 'percentag', 'member', 'will', 'share', 'also', 'need', 'govern', 'share', 'healthcar', 'relat', 'cyber', 'intellig', 'similar', 'speed']",{'cyber'},Y
330,"Ultimately,   we need to automate the entire process to minimize any delays in responding to rapidly   changing threats.","['ultim', 'need', 'autom', 'entir', 'process', 'minim', 'delay', 'respond', 'rapidli', 'chang', 'threat']",set(),N
331,4.,[],set(),N
332,Facilitate Healthcare Cybersecurity Table Top Exercises and Simulations.,"['facilit', 'healthcar', 'cybersecur', 'tabl', 'top', 'exercis', 'simul']",{'cybersecur'},Y
333,"DHS   conducts a nation-wide, cybersecurity exercise every two years.","['dh', 'conduct', 'cybersecur', 'exercis', 'everi', 'two', 'year']",{'cybersecur'},Y
334,"The latest exercise, Cyber   Storm V, was conducted March 8-10, 2016.","['latest', 'exercis', 'cyber', 'storm', 'v', 'conduct', 'march']",{'cyber'},Y
335,It was the first year in which the healthcare   sector had dedicated participation in the exercise.,"['first', 'year', 'healthcar', 'sector', 'dedic', 'particip', 'exercis']",set(),N
336,The exercise included a number of   healthcare specific scenarios that tested the readiness of the sector to respond to a   cybersecurity emergency.,"['exercis', 'includ', 'number', 'healthcar', 'specif', 'scenario', 'test', 'readi', 'sector', 'respond', 'cybersecur', 'emerg']","{'includ', 'cybersecur'}",Y
337,The lessons learned were invaluable .,"['lesson', 'learn', 'invalu']",set(),N
338,"As the SSA for the   healthcare sector, HHS should consider conducting smaller and more frequent exercises with   a broader array of healthcare firms and include scenarios that substantially test the resilience   of the sector.","['ssa', 'healthcar', 'sector', 'hh', 'consid', 'conduct', 'smaller', 'frequent', 'exercis', 'broader', 'array', 'healthcar', 'firm', 'includ', 'scenario', 'substanti', 'test', 'resili', 'sector']",{'includ'},Y
339,5.,[],set(),N
340,Collaborate on the Implementation of a Digital Healthcare Identity Based on Leading   Government and Private Sector Standard That Are Mature and In Place.,"['collabor', 'implement', 'digit', 'healthcar', 'ident', 'base', 'lead', 'govern', 'privat', 'sector', 'standard', 'matur', 'place']","{'implement', 'standard'}",Y
341,Passwords        Page 10   Cybersecurity in the Healthcare Sector: Strengthening Public-Private Partnerships   are still the most frequently used authentication mechanism to gain access to healthcare data   and systems and should not be.,"['password', 'page', 'cybersecur', 'healthcar', 'sector', 'strengthen', 'partnership', 'still', 'frequent', 'use', 'authent', 'mechan', 'gain', 'access', 'healthcar', 'data', 'system']","{'access', 'cybersecur'}",Y
342,Passwords are one of the least effective mechanisms to   protect sensitive data and applications.,"['password', 'one', 'least', 'effect', 'mechan', 'protect', 'sensit', 'data', 'applic']",set(),N
