No.,Sentence,StemWords,MatchWords,Use
616,"Through the National Cyber Coordination and Integration Center (NCCIC), government   and industry are in the early stages of implementing a long-standing recommendation that  industry responders from the IT and communications sectors should work together with their  government counterparts in an integrated operations center so that their respective expertise,  analysis, and response capabilities can be shared and leveraged on a sustained basis – not just  in times of crisis.","['nation', 'cyber', 'coordin', 'integr', 'center', 'nccic', 'govern', 'industri', 'earli', 'stage', 'implement', 'recommend', 'industri', 'respond', 'commun', 'sector', 'work', 'togeth', 'govern', 'counterpart', 'integr', 'oper', 'center', 'respect', 'expertis', 'analysi', 'respons', 'capabl', 'share', 'leverag', 'sustain', 'basi', 'time', 'crisi']","{'work', 'industri', 'implement', 'cyber'}",Y
617,The NCCIC is a very positive development in the public-private partnership  and should be strengthened by the full participation of industry.,"['nccic', 'posit', 'develop', 'partnership', 'strengthen', 'full', 'particip', 'industri']","{'industri', 'develop'}",Y
618,Recommendation:  Government should fully establish industry’s seat in the integrated watch  center and begin evaluation and process for growing industry’s presence; industry should  ensure a long-term plan for filling the watch center seats; and participants should report  lessons learned from collaborative exercises as soon as possible and undertake improvement  measures on a timely basis.,"['recommend', 'govern', 'fulli', 'establish', 'industri', 'seat', 'integr', 'watch', 'center', 'begin', 'evalu', 'process', 'grow', 'industri', 'presenc', 'industri', 'ensur', 'plan', 'fill', 'watch', 'center', 'seat', 'particip', 'report', 'lesson', 'learn', 'collabor', 'exercis', 'soon', 'possibl', 'undertak', 'improv', 'measur', 'time', 'basi']","{'industri', 'measur'}",Y
619,III.,['iii'],set(),N
620,INFORMATION SHARING AND PRIVACY   Effective information sharing is crucial to any collective effort to prevent cyber attacks     and to respond to cyber incidents.,"['inform', 'share', 'privaci', 'effect', 'inform', 'share', 'crucial', 'collect', 'effort', 'prevent', 'cyber', 'attack', 'respond', 'cyber', 'incid']","{'cyber', 'inform'}",Y
621,"Information sharing, as practiced today, is not sufficient or effective enough to address  cybersecurity threats.","['inform', 'share', 'practic', 'today', 'suffici', 'effect', 'enough', 'address', 'cybersecur', 'threat']","{'practic', 'inform', 'cybersecur'}",Y
622,Government and industry partners should first articulate the types and  sources of information and analysis that need to be shared in order to achieve our nation’s  cybersecurity goals and identify the types of information that are not being sufficiently shared.,"['govern', 'industri', 'partner', 'first', 'articul', 'type', 'sourc', 'inform', 'analysi', 'need', 'share', 'order', 'achiev', 'nation', 'cybersecur', 'goal', 'identifi', 'type', 'inform', 'suffici', 'share']","{'industri', 'inform', 'cybersecur'}",Y
623,"Various proposals have been put forward to impose mandates on industry to share information  with a new government “clearinghouse” that would process the information it received,  achieve situational awareness with respect to the health of major public and private networks,  and disseminate information to owners and operators of those networks to prevent and  respond to cyber incidents.","['variou', 'propos', 'put', 'forward', 'impos', 'mandat', 'industri', 'share', 'inform', 'new', 'govern', 'clearinghous', 'would', 'process', 'inform', 'receiv', 'achiev', 'situat', 'awar', 'respect', 'health', 'major', 'public', 'privat', 'network', 'dissemin', 'inform', 'owner', 'oper', 'network', 'prevent', 'respond', 'cyber', 'incid']","{'industri', 'cyber', 'network', 'inform'}",Y
624,"13      However, the objective should be to improve the quality, not necessarily the quantity,  of the information shared.","['howev', 'object', 'improv', 'qualiti', 'necessarili', 'quantiti', 'inform', 'share']",{'inform'},Y
625,"Rather, the scope of the information exchange should be driven by  an analysis of the respective roles of the private sector and the government and by a better  understanding of the collective or collaborative action needed to combat current or future  attacks.","['rather', 'scope', 'inform', 'exchang', 'driven', 'analysi', 'respect', 'role', 'privat', 'sector', 'govern', 'better', 'understand', 'collect', 'collabor', 'action', 'need', 'combat', 'current', 'futur', 'attack']",{'inform'},Y
626,"Based on such a framework, more nimble approaches can be developed to muster the  kind of information sharing necessary to meet cybersecurity challenges.","['base', 'framework', 'nimbl', 'approach', 'develop', 'muster', 'kind', 'inform', 'share', 'necessari', 'meet', 'cybersecur', 'challeng']","{'develop', 'inform', 'cybersecur'}",Y
627,"Also, such a  framework will more likely produce information-sharing procedures that do not involve the  routine sharing of data about traffic over private networks, which poses acute concerns for civil  liberties and the protection of financial and proprietary information or intellectual property.","['also', 'framework', 'like', 'produc', 'procedur', 'involv', 'routin', 'share', 'data', 'traffic', 'privat', 'network', 'pose', 'acut', 'concern', 'civil', 'liberti', 'protect', 'financi', 'proprietari', 'inform', 'intellectu', 'properti']","{'network', 'inform'}",Y
628,"Sector-designated information-sharing mechanisms, such as the ISACs, are now   integrated into the public-private partnership framework.","['mechan', 'isac', 'integr', 'partnership', 'framework']",set(),N
629,"Some sectors, such as finance,  information technology and communications, are well known to have strong and proven  information-sharing capabilities.","['sector', 'financ', 'inform', 'technolog', 'commun', 'well', 'known', 'strong', 'proven', 'capabl']","{'inform', 'technolog'}",Y
630,"An approach to information-sharing that focuses on  identifying information requirements for sectors, and organizations within sectors, and building  the capacity of these existing information sharing mechanisms and on building the capacity of  the U.S. Computer Emergency Readiness Team (U.S.-CERT) in DHS is more likely to have  immediate results.","['approach', 'focus', 'identifi', 'inform', 'requir', 'sector', 'organ', 'within', 'sector', 'build', 'capac', 'exist', 'inform', 'share', 'mechan', 'build', 'capac', 'comput', 'emerg', 'readi', 'team', 'dh', 'like', 'immedi', 'result']","{'organ', 'inform', 'requir'}",Y
631,"In contrast, a top-down, government-centric approach is unlikely to be able  to react with the agility necessary to deal with rapidly evolving threats and attacks.","['contrast', 'approach', 'unlik', 'abl', 'react', 'agil', 'necessari', 'deal', 'rapidli', 'evolv', 'threat', 'attack']",set(),N
632,Enhanced self-interest and a flexible approach are more likely than government   mandates to result in the sharing of the most useful cybersecurity information.,"['enhanc', 'flexibl', 'approach', 'like', 'govern', 'mandat', 'result', 'share', 'use', 'cybersecur', 'inform']","{'inform', 'cybersecur'}",Y
633,"As with any  other partnership function, information sharing is founded upon and enabled by trust.","['partnership', 'function', 'inform', 'share', 'found', 'upon', 'enabl', 'trust']",{'inform'},Y
634,That  trust is weakened when government information-sharing mandates are imposed.,"['trust', 'weaken', 'govern', 'mandat', 'impos']",set(),N
635,"Therefore,  they are far less effective than a private sector-driven, well–incentivized program of  collaboration.","['therefor', 'far', 'less', 'effect', 'privat', 'program', 'collabor']",set(),N
636,"However, government does have an important role in fostering the effectiveness  of information-sharing mechanisms.","['howev', 'govern', 'import', 'role', 'foster', 'effect', 'mechan']",set(),N
637,"For example, government can increase market-based  incentives for sharing information through mechanisms such as creating safe harbors, so that  information that is shared about an incident, and that belongs to carefully defined categories of  cybersecurity information, is not used to establish liability about the incident.","['exampl', 'govern', 'increas', 'incent', 'share', 'inform', 'mechan', 'creat', 'safe', 'harbor', 'inform', 'share', 'incid', 'belong', 'care', 'defin', 'categori', 'cybersecur', 'inform', 'use', 'establish', 'liabil', 'incid']","{'inform', 'cybersecur'}",Y
638,Information sharing also needs to evolve with modern threat patterns.,"['inform', 'share', 'also', 'need', 'evolv', 'modern', 'threat', 'pattern']",{'inform'},Y
639,"For example, the     information sharing model referenced in the CSPR11 shifts the focus from sharing inbound  attacks and technical vulnerabilities to unauthorized outbound traffic and needs to be  developed.","['exampl', 'inform', 'share', 'model', 'referenc', 'shift', 'focu', 'share', 'inbound', 'attack', 'technic', 'vulner', 'unauthor', 'outbound', 'traffic', 'need', 'develop']","{'develop', 'inform'}",Y
640,"Since many modern attacks such as advanced persistent threats (APT) are not  successful until data is exported from the system, managing unauthorized URLs and websites                                                               11 Obama Administration, Cyberspace Policy Review – Assuring a Trusted and Resilient  Information and Communications Infrastructure, May 2009 at A-4, citing Internet Security alliance, paper by Jeff  Brown, Raytheon Company, entitled A National Model for Cyber Protection Through Disrupting Attacker Command  and Control Channels, March 2009.","['sinc', 'mani', 'modern', 'attack', 'advanc', 'persist', 'threat', 'apt', 'success', 'data', 'export', 'system', 'manag', 'unauthor', 'url', 'websit', 'obama', 'administr', 'cyberspac', 'polici', 'review', 'assur', 'trust', 'resili', 'inform', 'commun', 'infrastructur', 'may', 'cite', 'internet', 'secur', 'allianc', 'paper', 'jeff', 'brown', 'raytheon', 'compani', 'entitl', 'nation', 'model', 'cyber', 'protect', 'disrupt', 'attack', 'command', 'control', 'channel', 'march']","{'control', 'inform', 'internet', 'manag', 'cyber', 'secur'}",Y
641,14      can be an effective defense.,"['effect', 'defens']",set(),N
642,Sharing this information side-steps some of the current barriers to  sharing since no proprietary or source data is required.,"['share', 'inform', 'current', 'barrier', 'share', 'sinc', 'proprietari', 'sourc', 'data', 'requir']","{'inform', 'requir'}",Y
643,"Moreover, simply blocking unauthorized  command and control sites is much easier; hence, this actionable information can be shared  broadly using something similar to the current anti-virus model, which may even allow for the  development of a market-based system with incentives for both the sharing and distributing  parties.","['moreov', 'simpli', 'block', 'unauthor', 'command', 'control', 'site', 'much', 'easier', 'henc', 'action', 'inform', 'share', 'broadli', 'use', 'someth', 'similar', 'current', 'model', 'may', 'even', 'allow', 'develop', 'system', 'incent', 'share', 'distribut', 'parti']","{'develop', 'control', 'inform'}",Y
644,The government can also play a role by more effectively sharing the cybersecurity   information that industry would find valuable to identify and remove the most sophisticated  attacks.,"['govern', 'also', 'play', 'role', 'effect', 'share', 'cybersecur', 'inform', 'industri', 'would', 'find', 'valuabl', 'identifi', 'remov', 'sophist', 'attack']","{'industri', 'inform', 'cybersecur'}",Y
645,There should be an assessment of the extent to which attack signatures and other  information encountered by intelligence agencies can be shared with industry.,"['assess', 'extent', 'attack', 'signatur', 'inform', 'encount', 'intellig', 'agenc', 'share', 'industri']","{'industri', 'inform'}",Y
646,The current  policy against sharing that data can be detrimental to security if information is not shared with  those that need it to meet their security missions.,"['current', 'polici', 'share', 'data', 'detriment', 'secur', 'inform', 'share', 'need', 'meet', 'secur', 'mission']","{'secur', 'inform'}",Y
647,"If additional cleared private sector personnel  would be beneficial, then there should be a focused effort on filling that gap.","['addit', 'clear', 'privat', 'sector', 'personnel', 'would', 'benefici', 'focus', 'effort', 'fill', 'gap']",set(),N
648,Actionable threat  information sharing and effective response requires trusted sharing at the controlled  unclassified information (CUI) level with ISACs and equivalent information sharing mechanisms  appropriate for each sector.,"['action', 'threat', 'inform', 'share', 'effect', 'respons', 'requir', 'trust', 'share', 'control', 'unclassifi', 'inform', 'cui', 'level', 'isac', 'equival', 'inform', 'share', 'mechan', 'appropri', 'sector']","{'control', 'inform', 'requir'}",Y
649,Protection of personal privacy is essential to the operation of any cybersecurity     information-sharing or collection activity.,"['protect', 'person', 'privaci', 'essenti', 'oper', 'cybersecur', 'collect', 'activ']",{'cybersecur'},Y
650,It furthers an important societal value – personal  privacy – and will promote public acceptance of necessary cybersecurity measures.,"['further', 'import', 'societ', 'valu', 'person', 'privaci', 'promot', 'public', 'accept', 'necessari', 'cybersecur', 'measur']","{'measur', 'cybersecur'}",Y
651,"Cybersecurity measures should honor the promise of the Obama Administration and ensure  that the monitoring of private sector networks for malware or other malicious activity is  conducted by the private sector entities that operate them, not by the government.","['cybersecur', 'measur', 'honor', 'promis', 'obama', 'administr', 'ensur', 'monitor', 'privat', 'sector', 'network', 'malwar', 'malici', 'activ', 'conduct', 'privat', 'sector', 'entiti', 'oper', 'govern']","{'measur', 'network', 'cybersecur'}",Y
652,"“Our pursuit of cybersecurity will not – I repeat, will not – include [governmental] monitoring of  private sector networks or Internet traffic.","['pursuit', 'cybersecur', 'repeat', 'includ', 'government', 'monitor', 'privat', 'sector', 'network', 'internet', 'traffic']","{'internet', 'network', 'includ', 'cybersecur'}",Y
653,"We will preserve and protect the personal privacy  and civil liberties that we cherish as Americans.”        President Barack Obama, Release of the Cyberspace Policy Review, May 29, 2009      Building on the premise that system operators should be responsible for monitoring   their own systems, the analysis, collection and sharing of communications containing personally  identifiable information (PII) for cybersecurity purposes should comport generally with the Fair  Information Practice Principles.","['preserv', 'protect', 'person', 'privaci', 'civil', 'liberti', 'cherish', 'presid', 'barack', 'obama', 'releas', 'cyberspac', 'polici', 'review', 'may', 'build', 'premis', 'system', 'oper', 'respons', 'monitor', 'system', 'analysi', 'collect', 'share', 'commun', 'contain', 'person', 'identifi', 'inform', 'pii', 'cybersecur', 'purpos', 'comport', 'gener', 'fair', 'inform', 'practic', 'principl']","{'practic', 'inform', 'cybersecur'}",Y
654,"DHS adopted an articulation of these principles in its 2008      15      Privacy Policy Guide.12  In the cybersecurity context, application of these principles would mean  that:   ?","['dh', 'adopt', 'articul', 'principl', 'privaci', 'polici', 'cybersecur', 'context', 'applic', 'principl', 'would', 'mean']",{'cybersecur'},Y
655,Users are given notice of the cybersecurity monitoring and information sharing   program and that it may involve collection and use of PII;   ?,"['user', 'given', 'notic', 'cybersecur', 'monitor', 'inform', 'share', 'program', 'may', 'involv', 'collect', 'use', 'pii']","{'inform', 'cybersecur'}",Y
656,The cybersecurity purpose for which the PII would be collected is carefully   articulated;   ?,"['cybersecur', 'purpos', 'pii', 'would', 'collect', 'care', 'articul']",{'cybersecur'},Y
657,"Only the PII necessary to accomplish the purpose is collected and shared, and it is   used only for cybersecurity matters;   ?","['pii', 'necessari', 'accomplish', 'purpos', 'collect', 'share', 'use', 'cybersecur', 'matter']",{'cybersecur'},Y
658,"PII collected for cybersecurity purposes should be retained only as long as it takes to   fulfill the specified purpose, and then should be deleted by all parties;   ?","['pii', 'collect', 'cybersecur', 'purpos', 'retain', 'long', 'take', 'fulfil', 'specifi', 'purpos', 'delet', 'parti']",{'cybersecur'},Y
659,"To the maximum extent feasible, information is sanitized of information identifying   innocent parties before it is shared;   ?","['maximum', 'extent', 'feasibl', 'inform', 'sanit', 'inform', 'identifi', 'innoc', 'parti', 'share']",{'inform'},Y
660,"The PII collected is accurate, relevant, and timely, and it is properly safeguarded   against unauthorized access or improper disclosure; and   ?","['pii', 'collect', 'accur', 'relev', 'time', 'properli', 'safeguard', 'unauthor', 'access', 'improp', 'disclosur']",{'access'},Y
661,Actual use of the PII is audited to ensure compliance with these principles.,"['actual', 'use', 'pii', 'audit', 'ensur', 'complianc', 'principl']",set(),N
662,"Moreover, the collection and sharing of communications information for cybersecurity  purposes must comport with surveillance statues, including the Wiretap Act, 18 U.S.C.","['moreov', 'collect', 'share', 'commun', 'inform', 'cybersecur', 'purpos', 'must', 'comport', 'surveil', 'statu', 'includ', 'wiretap', 'act']","{'includ', 'inform', 'cybersecur'}",Y
663,"2510 et  seq., the Stored Communications Act, 18 U.S.C.","['et', 'store', 'commun', 'act']",set(),N
664,"2701 et seq., the Foreign Intelligence  Surveillance Act, 50 U.S.C.","['et', 'foreign', 'intellig', 'surveil', 'act']",set(),N
665,"1801 et seq., and the pen register and trap and trace statute, 18  U.S.C.","['et', 'pen', 'regist', 'trap', 'trace', 'statut']",set(),N
666,3121 et seq.,"['et', 'seq']",set(),N
667,These laws already give substantial authority to providers and other system  operators to monitor their own networks for cybersecurity.,"['law', 'alreadi', 'give', 'substanti', 'author', 'provid', 'system', 'oper', 'monitor', 'network', 'cybersecur']","{'network', 'cybersecur'}",Y
668,"For example, the Wiretap Act  permits electronic communication service providers to intercept, use, and disclose  communications passing over their networks while they are engaged in any activity that is a  “necessary incident” to the protection of their rights and property.13  In addition, the computer  trespasser exception to the Wiretap Act permits a service provider to authorize the government  to intercept the communications of a person who accesses a computer without authorization if  there are reasonable grounds to believe that the communication is relevant to an investigation  of the trespass.14 Transparency about the extent of disclosures now being made under these  exceptions would enhance the ability of Congress and the public to assess their effectiveness  and impact on privacy.","['exampl', 'wiretap', 'act', 'permit', 'electron', 'commun', 'servic', 'provid', 'intercept', 'use', 'disclos', 'commun', 'pass', 'network', 'engag', 'activ', 'necessari', 'incid', 'protect', 'right', 'addit', 'comput', 'trespass', 'except', 'wiretap', 'act', 'permit', 'servic', 'provid', 'author', 'govern', 'intercept', 'commun', 'person', 'access', 'comput', 'without', 'author', 'reason', 'ground', 'believ', 'commun', 'relev', 'investig', 'transpar', 'extent', 'disclosur', 'made', 'except', 'would', 'enhanc', 'abil', 'congress', 'public', 'assess', 'effect', 'impact', 'privaci']","{'network', 'access'}",Y
669,"While current law provides substantial authority to collect, use, and disclose   communications, including content for self-defense purposes, it does not provide explicit                                                                12 U.S. Department of Homeland Security, Privacy Policy Guidance Memorandum, December 29, 2008,  http://www.dhs.gov/xlibrary/assets/privacy/privacy_policyguide_2008-01.pdf  13 18 U.S.C.","['current', 'law', 'provid', 'substanti', 'author', 'collect', 'use', 'disclos', 'commun', 'includ', 'content', 'purpos', 'provid', 'explicit', 'depart', 'homeland', 'secur', 'privaci', 'polici', 'guidanc', 'memorandum', 'decemb', 'http']","{'secur', 'includ'}",Y
670,2511(2)(a)(i).,[],set(),N
671,14 18 U.S.C.,[],set(),N
672,2511(2)(i).,[],set(),N
673,16      authority to do the same for the defense of others.,"['author', 'defens', 'other']",set(),N
674,"As noted above, further inquiry is needed  to determine exactly what information needs to be shared, but where there are legal barriers  to necessary information sharing, it may be necessary for Congress to create a very narrow  exception to the surveillance laws to permit such disclosures.","['note', 'inquiri', 'need', 'determin', 'exactli', 'inform', 'need', 'share', 'legal', 'barrier', 'necessari', 'inform', 'share', 'may', 'necessari', 'congress', 'creat', 'narrow', 'except', 'surveil', 'law', 'permit', 'disclosur']",{'inform'},Y
675,"Under any such exception,  disclosures should be permissive and not mandatory and should be made only for cybersecurity  purposes and only when a reasonableness standard is met.","['except', 'disclosur', 'permiss', 'mandatori', 'made', 'cybersecur', 'purpos', 'reason', 'standard', 'met']","{'cybersecur', 'standard'}",Y
676,"Recommendation: Government and industry should clearly articulate information needs and  how to promote more effective information sharing to address those needs; information  sharing for cybersecurity purposes should be transparent and should comply with fair  information practice principles; government should consider how it can share more classified  and sensitive information, particularly the parts of that information that can help the private  sector defend its systems; and in consultation with interested parties, including industry and  civil liberties organizations, Congress should consider whether narrow adjustments to  surveillance laws are needed for cybersecurity purposes.","['recommend', 'govern', 'industri', 'clearli', 'articul', 'inform', 'need', 'promot', 'effect', 'inform', 'share', 'address', 'need', 'inform', 'share', 'cybersecur', 'purpos', 'transpar', 'compli', 'fair', 'inform', 'practic', 'principl', 'govern', 'consid', 'share', 'classifi', 'sensit', 'inform', 'particularli', 'part', 'inform', 'help', 'privat', 'sector', 'defend', 'system', 'consult', 'interest', 'parti', 'includ', 'industri', 'civil', 'liberti', 'organ', 'congress', 'consid', 'whether', 'narrow', 'adjust', 'surveil', 'law', 'need', 'cybersecur', 'purpos']","{'industri', 'inform', 'practic', 'organ', 'includ', 'cybersecur'}",Y
677,IV.,['iv'],set(),N
678,INTERNATIONAL ENGAGEMENT   The cyber networks and infrastructure constitute a global system where traditional   borders do not apply.,"['intern', 'engag', 'cyber', 'network', 'infrastructur', 'constitut', 'global', 'system', 'tradit', 'border', 'appli']","{'cyber', 'intern', 'network'}",Y
679,"Not only are our companies and networks global, but so are our  adversaries’.","['compani', 'network', 'global', 'adversari']",{'network'},Y
680,This global attribute must be taken into consideration for any policy or  operational aspect of cybersecurity.,"['global', 'attribut', 'must', 'taken', 'consider', 'polici', 'oper', 'aspect', 'cybersecur']",{'cybersecur'},Y
681,"Any public policy deliberation must consider the impact of that policy on global   competitiveness, interoperability, and compliance obligations.","['public', 'polici', 'deliber', 'must', 'consid', 'impact', 'polici', 'global', 'competit', 'interoper', 'complianc', 'oblig']",set(),N
682,The companies that fuel our  nation’s economic growth are operating globally in one way or another.,"['compani', 'fuel', 'nation', 'econom', 'growth', 'oper', 'global', 'one', 'way', 'anoth']",set(),N
683,"They either have  business operations in many other countries, source their products and services globally, or rely  on just-in-time delivery of components or products to meet their domestic customers’ needs.","['either', 'busi', 'oper', 'mani', 'countri', 'sourc', 'product', 'servic', 'global', 'reli', 'deliveri', 'compon', 'product', 'meet', 'domest', 'custom', 'need']",set(),N
684,"Therefore, we cannot deliberate public policy with merely a national lens.","['therefor', 'deliber', 'public', 'polici', 'mere', 'nation', 'len']",set(),N
685,"Our nation’s policy  impacts the ability of its companies to do business globally, either directly through prescriptive  restrictions or indirectly as a result of reciprocity or copycat policies in other countries.","['nation', 'polici', 'impact', 'abil', 'compani', 'busi', 'global', 'either', 'directli', 'prescript', 'restrict', 'indirectli', 'result', 'reciproc', 'copycat', 'polici', 'countri']",set(),N
686,"Further, if U.S. policies raise concern about the level of government engagement in  corporate networks or data, it will raise skepticism by global customers regarding the U.S.  government’s access to their corporate or consumer data and the implications of that access.","['polici', 'rais', 'concern', 'level', 'govern', 'engag', 'corpor', 'network', 'data', 'rais', 'skeptic', 'global', 'custom', 'regard', 'govern', 'access', 'corpor', 'consum', 'data', 'implic', 'access']","{'network', 'access'}",Y
687,Customers will simply go elsewhere to find providers that do not pose the same concern.,"['custom', 'simpli', 'go', 'elsewher', 'find', 'provid', 'pose', 'concern']",set(),N
